Player,Offense,Defense,GP,Name,Squad,Viable
"Caern Lewendail",0,1,125580,Grievous,"zzGG zB2 zB1 MagnaGuard zNute",1
"Caern Lewendail",1,0,110110,Traya,"zzTraya zDN zSion Sith Empire Trooper, zThrawn",1
"Caern Lewendail",,,105449,Mon Mothma,"zzMon Mothma, zPao Hoth Rebel Scout, zCara Dune, Wedge",1
"Caern Lewendail",1,0,116221,Troopers,"zVeers zzAdmiral Piett, Moff Gideon, zDark Trooper, Range Trooper",1
"Caern Lewendail",1,0,148946,CLS,"zzzCLS zHan zzChewbacca zChewpio zzC-3PO",1
"Caern Lewendail",,,117072,Disintegration,"Aurra Greef Karga, zBoba zzBossk zThe Mandalorian",1
"Caern Lewendail",1,1,83655,Ewoks,"zChirpa G9, Elder Paploo zWicket Logray G9",1
"Caern Lewendail",1,0,140197,ShaakClones,"zzShaak Ti, zRex zEcho (501st), zzFives zARC Trooper",1
"Caern Lewendail",0,1,122204,BH,"zzJango Cad IG-88 Fennec Shand, Dengar",1
"Caern Lewendail",0,1,102905,FO,"zzKRU zKylo FOE FOST FOO",1
"Caern Lewendail",0,1,80408,Phoenix,"Hera G9, zEzra zZeb G9, Kanan G8, Sabine G8",1
"Caern Lewendail",1,1,73080,Rogue1,"Jyn G8, Chirrut G8, Baze G9, Cassian G9, K-2SO G8",1
"Caern Lewendail",1,0,123547,zMaul,"zDarth Maul, zDooku zSidious Savage Sith Marauder",1
"Caern Lewendail",1,0,111813,EP (Counter, Rebel),"zzEP Shoretrooper Krennic DT G9, zzWampa",1
"Caern Lewendail",1,0,70584,Jawas,"Nebit G8, Jawa Engineer, Jawa Scavenger, Jawa G9, Dathcha G8",1
"Caern Lewendail",,,80256,Bad Batch,"zHunter G9, zEcho Omega G8, Tech G9, zWrecker G8",0
"Mol Monez",0,1,124819,padme,"zzPadme zGK zJKA zAhsoka zzC-3PO",1
"Mol Monez",0,1,125937,DRMalak,"zzzDR zHK-47 BSF zzMalak zThrawn",1
"Mol Monez",0,1,96389,Geonosians,"zzGBA Sun Fac, Geo Soldier, Geo Spy, Poggle",1
"Mol Monez",0,1,111465,Grievous,"zzGG zB2 zB1 zDroideka MagnaGuard",1
"Mol Monez",1,1,124014,Revan Offense,"zzzJKR zzGMY zBS zJolee Ezra",1
"Mol Monez",1,1,95808,Ewoks,"zChirpa Elder zPaploo zWicket zLogray",1
"Mol Monez",1,0,130674,ShaakClones,"zzShaak Ti, zRex zEcho (501st), zzFives zARC Trooper",1
"Mol Monez",1,1,92869,Carth,"zCarth Onasi, zMission zZaalbar Juhani Canderous",1
"Mol Monez",0,1,108800,BH,"zzBossk zBoba zJango zThe Mandalorian, Greef Karga",1
"Mol Monez",1,0,88718,Wiggs,"Wedge Biggs G9, zzzCLS Han G9, Leia G9",1
"Mol Monez",1,1,127469,zEP,"zzEP zzVader Tarkin zDooku Krennic",1
"Mol Monez",,,74703,Phasma,"Phasma G7, FOTP FOSFTP G7, FOST 2* G8, zKylo",0
"Mol Monez",,,379217,Negotiator,"Negotiator BTL-B Y-wing Starfighter 3*, Anakin's Eta-2 Starfighter, Rex's ARC-170, Umbaran Starfighter, Ahsoka Tano's Jedi Starfighter, Plo Koon's Jedi Starfighter, Clone Sergeant's ARC-170",0
"Mol Monez",1,1,76730,JTR,"JTR G8, Scav Rey, BB-8 G7, zR2-D2 Finn G9",0
"Mol Monez",1,1,70209,NS,"zzMT G8, zAV Daka G8, Zombie G5, Spirit G8",0
"Mol Monez",,,53103,Mon Mothma,"Mon Mothma 4* G7, Chirrut G6, Lando Cara Dune G9, Bistan G6",0
"Mol Monez",1,0,51904,Troopers,"Veers G6, Starck G7, Stormtrooper G5, Snowtrooper G8, Magma G6",0
"Mol Monez",0,1,66407,Phoenix,"Hera G8, Zeb Kanan G8, Sabine 5* G7, Chopper",0
"Mol Monez",1,0,9831,SionSolo (Counter),"Sion 5* G8",0
"LeakproofComb2",1,1,148119,SL Kylo,"zzzzzzSL Kylo, zSith Trooper, zHux zzKRU zThrawn",1
"LeakproofComb2",0,1,122190,padme,"zzPadme zGK JKA zAhsoka zzC-3PO",1
"LeakproofComb2",1,0,149808,CLS,"zzzCLS zHan zzChewbacca zzR2-D2 Old Ben",1
"LeakproofComb2",,,403329,HansMF,"Home One, Han's MF, Rebel Y-wing, Bistan's U-wing, Phantom Biggs X-wing, Cassian's U-wing, Wedge X-wing",1
"LeakproofComb2",,,436439,Negotiator,"Negotiator HT Anakin's Eta-2 Starfighter, Umbaran Starfighter, Ahsoka Tano's Jedi Starfighter, Clone Sergeant's ARC-170, Plo Koon's Jedi Starfighter, Rex's ARC-170",1
"LeakproofComb2",0,1,94196,Geonosians,"zzGBA Sun Fac, Geo Soldier, Geo Spy, Poggle",1
"LeakproofComb2",0,1,111612,Grievous,"zzGG zB2 zB1 zDroideka MagnaGuard",1
"LeakproofComb2",1,1,137192,GAS,"zzzzGAS zRex Echo (501st), zzFives ARC Trooper",1
"LeakproofComb2",1,1,117056,Revan Offense,"zzzJKR zGMY zBS zJolee zHYoda",1
"LeakproofComb2",1,1,85953,Ewoks,"zChirpa Elder zPaploo Scout Wicket G8",1
"LeakproofComb2",0,1,130368,BH,"zBossk Boba Cad IG-88 Dengar",1
"LeakproofComb2",1,1,129489,zEP,"zzEP zzzVader Tarkin TFP zBSF",1
"LeakproofComb2",0,1,71508,Phoenix,"Hera G8, Ezra Zeb G8, Kanan G8, Chopper G8",1
"LeakproofComb2",1,0,15624,SionSolo (Counter),"Sion G9",1
"LeakproofComb2",,,120371,Phasma,"Phasma zFOTP FOSFTP FOST zKylo",0
"LeakproofComb2",,,285420,Malevolence,"Malevolence Hyena Bomber 6*, Vulture Droid, Sun Fac SF, Soldier SF, Spy SF",0
"LeakproofComb2",1,1,71421,NS,"MT G8, AV Daka Zombie G8, Spirit G8",0
"LeakproofComb2",,,417233,Executrix,"Executrix Tie Adv, Emperor's Shuttle 4*, TIE Reaper 4*, Imperial TIE Fighter, Gauntlet Starfighter, First Order SF TIE Fighter, First Order TIE Fighter",0
"LeakproofComb2",,,83304,Nute-Wat,"Nute Dooku zWat Tambor, Jango Nest G7",0
"LeakproofComb2",1,0,82452,Troopers,"Veers G8, zzAdmiral Piett, Moff Gideon G7, Dark Trooper G7, Range Trooper G7",0
"LeakproofComb2",,,107300,Mon Mothma,"zzMon Mothma, Chirrut G8, Lando Biggs Wedge",0
"LeakproofComb2",1,1,80827,Carth,"Carth Onasi, Mission Zaalbar Juhani G7, Canderous",0
"LeakproofComb2",,,57071,Iden Troopers,"Iden Versio 6* G7, Stormtrooper G8, Snowtrooper G7, Magma G8, DT G7",0
"LeakproofComb2",,,42959,Bad Batch,"Hunter 4* G7, Echo 3* G7, Omega G8, Tech 3* G8, Wrecker 5* G7",0
"Nute  Gunray",1,1,170533,GL Rey,"zzzzzzRey zzzJTR zzR2-D2 zResistance Hero Poe, zResistance Hero Finn",1
"Nute  Gunray",0,1,131747,padme,"zzPadme zGK JKA zAhsoka zzC-3PO",1
"Nute  Gunray",1,1,99561,NS_Alt,"zzMT zAV Talia Zombie zDaka",1
"Nute  Gunray",0,1,102140,Geonosians,"zzGBA Sun Fac, Geo Soldier, Geo Spy, Poggle",1
"Nute  Gunray",,,125207,Nute-Wat,"zNute zDooku zWat Tambor, zJango zNest",1
"Nute  Gunray",1,1,106959,Revan Offense,"zzJKR zGMY zBS zJolee Ezra",1
"Nute  Gunray",1,1,100415,Ewoks,"zChirpa Elder zPaploo Teebo zWicket",1
"Nute  Gunray",1,1,87940,Carth,"zCarth Onasi, zMission zZaalbar Juhani G8, Canderous",1
"Nute  Gunray",0,1,97334,BH,"zBossk Greedo Boba Cad zZam",1
"Nute  Gunray",1,1,103596,zEP,"zzEP zzzVader Tarkin TFP G8, BSF",1
"Nute  Gunray",1,0,92370,IG88,"IG-88 G8, GG zBB-8 zT3-M4 L3-37 G9",1
"Nute  Gunray",1,0,14284,SionSolo (Counter),"Sion G8",1
"Nute  Gunray",,,77426,Phasma,"Phasma FOTP FOO zKRU Kylo 6* G8",0
"Nute  Gunray",,,342554,HansMF,"Home One, Han's MF, Rebel Y-wing 5*, Bistan's U-wing 5*, Phantom Ghost Cassian's U-wing 5*, Biggs X-wing",0
"Nute  Gunray",,,89878,Mon Mothma,"zzMon Mothma, Chirrut zPao Cara Dune, Bistan",0
"Nute  Gunray",1,0,82263,ShaakClones,"zShaak Ti, Rex Echo (501st) 5* G9, Fives G8, Clone Sergeant",0
"Nute  Gunray",1,0,95680,CLS,"zCLS zHan Leia G8, Old Ben, zChewbacca",0
"Nute  Gunray",0,1,75329,Phoenix,"zHera zZeb G8, zKanan G8, Sabine 6* G8, Chopper",0
"Yaru Corsin",,,580837,Executor,"Executor HT Razor Crest, Xanadu Blood, Slave I, IG-2000 Imperial TIE Fighter, Tie Adv",1
"Yaru Corsin",,,161907,JMLS,"zzzJKR zzJKL zzzzzzJMLS zWat Tambor, zzzzGAS",1
"Yaru Corsin",0,1,140707,padme,"zzPadme zGK zJKA zAhsoka zzC-3PO",1
"Yaru Corsin",0,1,124003,DRMalak,"zzzDR zzHK-47 zBSF zzMalak Sith Empire Trooper",1
"Yaru Corsin",,,488282,Negotiator,"Negotiator BTL-B Y-wing Starfighter, Anakin's Eta-2 Starfighter, Rex's ARC-170, Umbaran Starfighter, Ahsoka Tano's Jedi Starfighter, Plo Koon's Jedi Starfighter, Clone Sergeant's ARC-170",1
"Yaru Corsin",1,0,148635,CLS,"zzzCLS zHan zzChewbacca zzR2-D2 zzOld Ben",1
"Yaru Corsin",,,424649,HansMF,"Home One, Han's MF, Rebel Y-wing, Bistan's U-wing, Phantom Ghost Cassian's U-wing, Wedge X-wing",1
"Yaru Corsin",0,1,94399,Geonosians,"zzGBA Sun Fac, Geo Soldier, Geo Spy, Poggle",1
"Yaru Corsin",0,1,117046,Grievous,"zzGG zB2 zB1 zMagnaGuard zNute",1
"Yaru Corsin",1,0,126298,Traya,"zzTraya zDN zSion zzEP zzThrawn",1
"Yaru Corsin",1,1,89747,Ewoks,"zChirpa Elder zPaploo zWicket zLogray",1
"Yaru Corsin",1,0,139225,ShaakClones,"zzShaak Ti, zRex zEcho (501st), zzFives zARC Trooper",1
"Yaru Corsin",0,1,139808,BH,"zzBossk zBoba Cad zIG-88 zDengar",1
"Yaru Corsin",1,1,93174,Carth,"zCarth Onasi, zMission zZaalbar zJuhani G8, zCanderous",1
"Yaru Corsin",0,1,109870,BH,"zzJango zGreedo zThe Mandalorian, zZam zzGreef Karga",1
"Yaru Corsin",1,0,121212,Troopers,"zVeers zStarck Range Trooper, zDark Trooper, zzAdmiral Piett",1
"Yaru Corsin",0,1,94444,Phoenix,"zHera zEzra zZeb zKanan zSabine",1
"Yaru Corsin",1,1,70032,Rogue1,"Jyn G8, Chirrut G8, Baze G8, Cassian G8, K-2SO G8",1
"Yaru Corsin",1,0,61535,QiraNest,"Qira G9, zNest zzHYoda",1
"Yaru Corsin",,,64264,Phasma,"Phasma G8, FOTP G9, FOSFTP G4, FOST G8, zKylo",0
"Yaru Corsin",,,285611,Malevolence,"Malevolence Hyena Bomber 5*, Vulture Droid, Sun Fac SF, Soldier SF, Spy SF",0
"Yaru Corsin",1,1,77737,NS,"MT G8, zAV Daka Zombie Spirit",0
"Yaru Corsin",,,112647,Mon Mothma,"zzMon Mothma, zKyle Katarn, Lando Biggs Wedge",0
"Yaru Corsin",,,63812,Iden Troopers,"Iden Versio G8, Stormtrooper G8, Snowtrooper G8, Magma G2, DT G8",0
"Yaru Corsin",1,0,102962,zMaul,"Darth Maul, zDooku Sidious zSavage Sith Marauder",0
"Yaru Corsin",1,0,56465,Jawas,"Nebit G8, Jawa Engineer 5* G8, Jawa Scavenger G8, Jawa G8, Dathcha G8",0
"Dwew",,,120185,Phasma,"zPhasma FOTP FOSFTP zFOST zKylo",1
"Dwew",1,1,151488,SL Kylo,"zzzzzzSL Kylo, zSith Trooper, zHux zzKRU zThrawn",1
"Dwew",0,1,110833,padme,"zzPadme zGK zJKA zAhsoka zzC-3PO",1
"Dwew",,,333198,Malevolence,"Malevolence Hyena Bomber, Vulture Droid, Sun Fac SF, Soldier SF, Spy SF",1
"Dwew",0,1,118160,Geonosians,"zzGBA Sun Fac, Geo Soldier, Geo Spy, Poggle",1
"Dwew",,,355197,HansMF,"Home One, Han's MF, HT Ghost Phantom Biggs X-wing, Cassian's U-wing, Wedge X-wing",1
"Dwew",1,1,92359,JTR,"zzJTR Scav Rey G8, BB-8 R2-D2 zFinn",1
"Dwew",1,1,106864,Revan Offense,"zzzJKR zGMY BS zJolee zzHYoda G8",1
"Dwew",1,1,89852,Ewoks,"zChirpa Elder zPaploo Wicket G8, zLogray",1
"Dwew",1,0,136140,ShaakClones,"zzShaak Ti, zRex zEcho (501st), zzFives zARC Trooper",1
"Dwew",0,1,111224,BH,"zzBossk zBoba Cad zzJango zDengar",1
"Dwew",1,1,88995,Carth,"Carth Onasi, zMission zZaalbar Juhani Canderous G8",1
"Dwew",1,0,114568,CLS,"zzzCLS zHan Leia G9, Old Ben G9, zzChewbacca",1
"Dwew",0,1,71570,Phoenix,"Hera G9, Ezra G8, Zeb G9, Kanan G8, Chopper",1
"Dwew",0,1,98721,DRMalak,"zzzDR HK-47 zBSF zzMalak 5* Sith Empire Trooper 6* G7",0
"Dwew",0,1,86219,Grievous,"zzGG B2 G8, B1 zDroideka G8, T3-M4 G7",0
"Dwew",1,1,65567,NS_Alt,"AV Talia G8, Zombie G8, zDaka G9, Spirit G8",0
"Dwew",1,1,98000,zEP,"zzEP zzzVader Tarkin Traya G7, Sion G6",0
"Drippy Spaff",0,1,119173,DRMalak,"zzzDR HK-47 zBSF zzMalak Sith Empire Trooper",1
"Drippy Spaff",0,1,134345,padme,"zzPadme zGK zJKA zAhsoka zzC-3PO",1
"Drippy Spaff",1,0,150641,CLS,"zzzCLS zHan zzChewbacca zzR2-D2 Old Ben",1
"Drippy Spaff",,,291876,Malevolence,"Malevolence 5* Hyena Bomber, Vulture Droid, Sun Fac SF, Soldier SF, Spy SF",1
"Drippy Spaff",,,389566,HansMF,"Home One, Han's MF, Rebel Y-wing, Bistan's U-wing, Phantom Biggs X-wing, Cassian's U-wing, Wedge X-wing",1
"Drippy Spaff",,,426459,Negotiator,"Negotiator 5* HT Anakin's Eta-2 Starfighter, Umbaran Starfighter, Ahsoka Tano's Jedi Starfighter, Clone Sergeant's ARC-170, Plo Koon's Jedi Starfighter, Rex's ARC-170",1
"Drippy Spaff",0,1,99361,Geonosians,"zzGBA Sun Fac, Geo Soldier, Geo Spy, Poggle",1
"Drippy Spaff",0,1,120198,Grievous,"zzGG zB2 zB1 MagnaGuard zNute",1
"Drippy Spaff",1,1,131804,Revan Offense,"zzzJKR zGMY BS zJolee zzHYoda",1
"Drippy Spaff",1,1,85025,Ewoks,"zChirpa G9, Elder Paploo zWicket Logray G9",1
"Drippy Spaff",0,1,136001,BH,"zzBossk Greedo zBoba IG-88 Dengar",1
"Drippy Spaff",1,1,121707,zEP,"zzEP zzVader zTarkin TFP zDN",1
"Drippy Spaff",0,1,70852,Phoenix,"Hera G8, Zeb G8, Kanan G8, Sabine G8, Chopper",1
"Drippy Spaff",1,0,17815,SionSolo (Counter),"zSion G9",1
"Drippy Spaff",1,0,14788,NestSolo (Counter),"Nest G9",1
"Drippy Spaff",,,62043,Phasma,"Phasma G8, Sith Trooper 4* G7, FOO KRU G8, Kylo G8",0
"Drippy Spaff",1,1,78205,NS,"MT G8, zAV Daka Zombie Spirit G8",0
"Drippy Spaff",1,0,93148,Troopers,"Veers zzAdmiral Piett, Moff Gideon G9, Dark Trooper G9, Range Trooper G7",0
"Drippy Spaff",,,110401,Mon Mothma,"zzMon Mothma, zKyle Katarn G9, Lando Biggs Wedge",0
"Drippy Spaff",1,1,98476,GAS,"zzzzGAS 6* G8, zRex zEcho (501st), zzFives G9, zARC Trooper G8",0
"Drippy Spaff",1,1,83610,Carth,"Carth Onasi, zMission zZaalbar Juhani Canderous G7",0
"Drippy Spaff",,,68274,Iden Troopers,"zIden Versio G8, Stormtrooper Snowtrooper G9, Magma G7, DT 6* G7",0
"Drippy Spaff",0,1,80294,BH,"Jango Cad The Mandalorian G8, Zam G8, Greef Karga G8",0
"Drippy Spaff",,,39607,Bad Batch,"Hunter 4* G8, Echo 3* G8, Omega 5* G8, Tech 3* G8, Wrecker 4* G7",0
"Drippy Spaff",1,1,50411,Rogue1,"Jyn 4* G7, Chirrut 6* G7, Baze 5* G7, Pao G8, Bistan G8",0
"Drippy Spaff",1,0,68268,Jawas,"Nebit G7, Jawa Engineer G9, Jawa Scavenger G8, Jawa Dathcha G8",0
"Garask",1,1,95745,NS,"zMT zzAV Daka Zombie Spirit",1
"Garask",,,170744,JMLS,"zzzJKR zzJKL zzzzzzJMLS zHYoda zzzzGAS",1
"Garask",0,1,148446,DRMalak,"zzzDR zzHK-47 zBSF zzMalak Sith Empire Trooper",1
"Garask",0,1,141920,padme,"zzPadme zGK zJKA zAhsoka zzC-3PO",1
"Garask",,,469287,Negotiator,"Negotiator BTL-B Y-wing Starfighter, Anakin's Eta-2 Starfighter, Rex's ARC-170, Umbaran Starfighter, Ahsoka Tano's Jedi Starfighter, Plo Koon's Jedi Starfighter, Clone Sergeant's ARC-170",1
"Garask",1,0,142554,CLS,"zzCLS zHan zzChewbacca zzR2-D2 Old Ben",1
"Garask",0,1,116707,Geonosians,"zzGBA Sun Fac, Geo Soldier, Geo Spy, Poggle",1
"Garask",0,1,136039,Grievous,"zzGG zB2 zB1 zMagnaGuard zNute",1
"Garask",1,0,115072,Troopers,"zVeers zzAdmiral Piett, zMoff Gideon, zDark Trooper, Range Trooper",1
"Garask",,,114771,Mon Mothma,"zzMon Mothma, zPao Biggs Hoth Rebel Scout, Wedge",1
"Garask",,,387361,Raddus,"Raddus 5* Sun Fac SF, Rey's Millennium Falcon, Poe Dameron's X-wing, Resistance X-wing, Biggs X-wing, Wedge X-wing, Phantom Ghost",1
"Garask",1,1,84851,Ewoks,"zChirpa Elder Paploo Wicket Logray",1
"Garask",1,0,140014,ShaakClones,"zzShaak Ti, zRex zEcho (501st), zzFives zARC Trooper",1
"Garask",0,1,102314,BH,"zzBossk Boba zJango The Mandalorian, Dengar",1
"Garask",1,1,95025,Carth,"zCarth Onasi, zMission zZaalbar Juhani Canderous",1
"Garask",1,1,112815,zEP,"zzEP zzVader Tarkin TFP G9, zSith Trooper",1
"Garask",0,1,122531,FO,"zzKRU zKylo zHux FOE FOO",1
"Garask",0,1,74140,Phoenix,"Hera G9, Ezra Zeb G8, Kanan Chopper G9",1
"Garask",1,0,23613,NestSolo (Counter),"zNest",1
"Garask",,,81825,Bad Batch,"zHunter G9, zEcho G9, Omega G9, Tech G9, zWrecker G9",0
"D'Squarius Green Jr",,,170413,JMK,"zzzzzzJMK zJKA zGMY zzShaak Ti, zGK",1
"D'Squarius Green Jr",,,166922,SEE,"zzzzzzSEE zBSF zzMalak zzzDR zzzVader",1
"D'Squarius Green Jr",,,588928,Executor,"Executor HT Razor Crest, Xanadu Blood, Slave I, IG-2000 Imperial TIE Fighter, Tie Adv",1
"D'Squarius Green Jr",,,175600,JMLS,"zzzJKR zzJKL zzzzzzJMLS zWat Tambor, zzzzGAS",1
"D'Squarius Green Jr",1,1,102915,NestSisters,"zzAV zzMT zDaka Zombie zNest",1
"D'Squarius Green Jr",,,501204,Negotiator,"Negotiator BTL-B Y-wing Starfighter, Anakin's Eta-2 Starfighter, Rex's ARC-170, Umbaran Starfighter, Ahsoka Tano's Jedi Starfighter, Plo Koon's Jedi Starfighter, Clone Sergeant's ARC-170",1
"D'Squarius Green Jr",1,0,147902,CLS,"zzzCLS zHan zzChewbacca zzR2-D2 zOld Ben",1
"D'Squarius Green Jr",,,407743,HansMF,"Home One, Han's MF, Rebel Y-wing 6*, Bistan's U-wing, Phantom Biggs X-wing, Cassian's U-wing, Wedge X-wing",1
"D'Squarius Green Jr",0,1,90405,Geonosians,"zzGBA Sun Fac, Geo Soldier, Geo Spy, Poggle",1
"D'Squarius Green Jr",0,1,128525,Grievous,"zzGG zB2 zB1 zMagnaGuard zNute",1
"D'Squarius Green Jr",1,0,116195,Traya,"zzTraya zzDN zSion Sith Empire Trooper, zzThrawn",1
"D'Squarius Green Jr",1,0,122596,Troopers,"zVeers zzAdmiral Piett, zzMoff Gideon, zDark Trooper, Range Trooper",1
"D'Squarius Green Jr",,,130853,Disintegration,"zAurra zzGreef Karga, zBoba zzBossk zzThe Mandalorian",1
"D'Squarius Green Jr",,,105357,Mon Mothma,"zzMon Mothma, Chirrut Biggs zCara Dune, Wedge",1
"D'Squarius Green Jr",1,1,86771,Ewoks,"zChirpa Elder zPaploo Wicket Logray",1
"D'Squarius Green Jr",1,1,94870,Carth,"zCarth Onasi, zMission zZaalbar Juhani Canderous",1
"D'Squarius Green Jr",0,1,129247,BH,"zzJango Cad zZam zIG-88 Dengar",1
"D'Squarius Green Jr",1,0,137017,501st,"zRex zARC Trooper, zEcho (501st), zzFives zAhsoka",1
"D'Squarius Green Jr",0,1,105641,FO,"zzKRU zKylo zHux FOE FOO",1
"D'Squarius Green Jr",0,1,76989,Phoenix,"Hera G9, Ezra Zeb G8, zKanan G9, zSabine G8",1
"D'Squarius Green Jr",1,0,126902,zMaul,"zDarth Maul, zDooku zSidious zSavage Sith Marauder",1
"D'Squarius Green Jr",1,0,116590,EP (Counter, Rebel),"zzEP Shoretrooper Krennic DT zzWampa",1
"D'Squarius Green Jr",,,292148,Malevolence,"Malevolence Hyena Bomber 5*, Vulture Droid 6*, Sun Fac SF, Soldier SF, Spy SF",0
"D'Squarius Green Jr",1,0,54355,Jawas,"Nebit G7, Jawa Engineer G8, Jawa Scavenger G7, Jawa G8, Dathcha G7",0
"MrJohnson4470",,,168971,JMLS,"zzzJKR zzJKL zzzzzzJMLS zHYoda zzzzGAS",1
"MrJohnson4470",0,1,133262,padme,"zzPadme zGK zJKA zAhsoka zzC-3PO",1
"MrJohnson4470",0,1,107104,DRMalak,"zzzDR HK-47 zBSF zzMalak Sith Assassin G8",1
"MrJohnson4470",,,467425,Negotiator,"Negotiator HT Anakin's Eta-2 Starfighter, Umbaran Starfighter, Ahsoka Tano's Jedi Starfighter, BTL-B Y-wing Starfighter, Clone Sergeant's ARC-170, Plo Koon's Jedi Starfighter",1
"MrJohnson4470",1,0,142445,CLS,"zzzCLS zHan zzChewbacca R2-D2 Old Ben",1
"MrJohnson4470",,,284778,Malevolence,"Malevolence Hyena Bomber, Vulture Droid, Sun Fac SF, Soldier SF, Spy SF",1
"MrJohnson4470",,,405614,HansMF,"Home One, Han's MF, Rebel Y-wing, Bistan's U-wing, Phantom Biggs X-wing, Cassian's U-wing, Wedge X-wing",1
"MrJohnson4470",0,1,92767,Geonosians,"zzGBA Sun Fac, Geo Soldier, Geo Spy, Poggle",1
"MrJohnson4470",0,1,112914,Grievous,"zzGG zB2 zB1 zMagnaGuard zNute",1
"MrJohnson4470",,,415373,Executrix,"Executrix Tie Adv, Emperor's Shuttle, TIE Reaper, Imperial TIE Fighter, Gauntlet Starfighter, First Order SF TIE Fighter, First Order TIE Fighter",1
"MrJohnson4470",1,1,86173,Ewoks,"zChirpa Elder Paploo Wicket Logray",1
"MrJohnson4470",1,0,130827,ShaakClones,"zzShaak Ti, zRex zEcho (501st), zzFives zARC Trooper",1
"MrJohnson4470",0,1,126283,BH,"zzBossk Boba Cad IG-88 Dengar",1
"MrJohnson4470",1,1,86136,Carth,"Carth Onasi, Mission Zaalbar Juhani Canderous",1
"MrJohnson4470",1,1,122567,zEP,"zzEP zzVader Tarkin Krennic TFP",1
"MrJohnson4470",0,1,69448,FO,"zKRU Kylo G8, FOE G9, FOST G8, FOO G8",1
"MrJohnson4470",0,1,75477,Phoenix,"Hera G9, Ezra Zeb G9, Kanan G9, Sabine G8",1
"MrJohnson4470",1,0,70371,Thragma (Counter),"zThrawn Magma G7, DT G8, Stormtrooper G8, Shoretrooper G8",1
"MrJohnson4470",1,1,67352,Rogue1,"Jyn G8, Chirrut G8, Baze G8, Cassian G9, K-2SO G8",1
"MrJohnson4470",1,0,15759,NestSolo (Counter),"Nest",1
"MrJohnson4470",1,0,17602,SionSolo (Counter),"zSion G9",1
"MrJohnson4470",1,1,80083,NS,"zzMT G8, zAV Daka G9, Zombie G8, Spirit G9",0
"MrJohnson4470",1,0,84999,Troopers,"Veers zzAdmiral Piett, Moff Gideon G7, Dark Trooper G9, Range Trooper G1",0
"MrJohnson4470",,,107382,Mon Mothma,"zzMon Mothma, Lando Biggs Cara Dune G9, Wedge",0
"MrJohnson4470",0,1,75751,BH,"Jango Greedo The Mandalorian, Zam G1, Greef Karga",0
"Sublime",,,122715,Phasma,"zPhasma zFOTP FOSFTP zFOST zKylo",1
"Sublime",1,1,157270,SL Kylo,"zzzzzzSL Kylo, zSith Trooper, zHux zzKRU zThrawn",1
"Sublime",,,528057,Executor,"Executor 5* HT Razor Crest, Xanadu Blood, Slave I, IG-2000 Imperial TIE Fighter, Tie Adv",1
"Sublime",0,1,150480,DRMalak,"zzzDR zzHK-47 zBSF zzMalak Sith Empire Trooper",1
"Sublime",0,1,138944,padme,"zzPadme zGK zJKA zAhsoka zzC-3PO",1
"Sublime",1,1,107051,NestSisters,"zzAV zzMT zDaka Zombie zNest",1
"Sublime",,,309711,Malevolence,"Malevolence Hyena Bomber, Vulture Droid, Sun Fac SF, Soldier SF, Spy SF",1
"Sublime",,,409622,HansMF,"Home One, Han's MF, Rebel Y-wing, Bistan's U-wing, Phantom Ghost Cassian's U-wing, Wedge X-wing",1
"Sublime",0,1,99366,Geonosians,"zzGBA Sun Fac, Geo Soldier, Geo Spy, Poggle",1
"Sublime",0,1,126984,Grievous,"zzGG zB2 zB1 zMagnaGuard zNute",1
"Sublime",1,1,104328,JTR,"zzzJTR Scav Rey, zBB-8 zzR2-D2 Finn",1
"Sublime",1,0,121092,Traya,"zzTraya zzDN zSion zDooku zzEP",1
"Sublime",1,1,147151,GAS,"zzzzGAS zRex zEcho (501st), zzFives zARC Trooper",1
"Sublime",1,1,119166,Revan Offense,"zzzJKR zGMY zBS zJolee zzHYoda",1
"Sublime",1,1,88657,Ewoks,"zChirpa Elder zPaploo Wicket Logray",1
"Sublime",0,1,131347,BH,"zzBossk zGreedo zBoba IG-88 Dengar",1
"Sublime",1,1,95278,Carth,"zCarth Onasi, zMission zZaalbar Juhani Canderous",1
"Sublime",0,1,77331,Phoenix,"Hera Ezra Zeb Kanan Sabine",1
"Sublime",1,0,117483,CLS,"zzzCLS zHan Wedge Biggs zzChewbacca",1
"Sublime",1,0,71241,Jawas,"Nebit G9, Jawa Engineer G9, Jawa Scavenger G9, Jawa Dathcha",1
"Sublime",,,471131,Negotiator,"Negotiator BTL-B Y-wing Starfighter, Anakin's Eta-2 Starfighter, Rex's ARC-170 6*, Umbaran Starfighter, Ahsoka Tano's Jedi Starfighter, Plo Koon's Jedi Starfighter, Clone Sergeant's ARC-170",0
"Sublime",1,0,89586,Troopers,"Veers G9, Starck G9, Stormtrooper Snowtrooper G9, zzAdmiral Piett",0
"Kiddbuu",,,120104,Phasma,"zPhasma zFOTP FOSFTP FOST zKylo",1
"Kiddbuu",1,1,138293,SL Kylo,"zzzzSL Kylo, Sith Trooper, zHux zzKRU Thrawn",1
"Kiddbuu",0,1,117528,DRMalak,"zzzDR zHK-47 BSF zzMalak Sith Empire Trooper",1
"Kiddbuu",0,1,126628,padme,"zzPadme zGK JKA zAhsoka zC-3PO",1
"Kiddbuu",,,458784,Negotiator,"Negotiator HT Anakin's Eta-2 Starfighter, Umbaran Starfighter, Ahsoka Tano's Jedi Starfighter, BTL-B Y-wing Starfighter, Clone Sergeant's ARC-170, Plo Koon's Jedi Starfighter",1
"Kiddbuu",,,360305,HansMF,"Home One, Han's MF, Rebel Y-wing, Ghost Phantom Biggs X-wing, Cassian's U-wing, Wedge X-wing",1
"Kiddbuu",0,1,94247,Geonosians,"zGBA Sun Fac, Geo Soldier, Geo Spy, Poggle",1
"Kiddbuu",1,1,85668,JTR,"zJTR R2-D2 G8, BB-8 Resistance Hero Finn, Resistance Hero Poe",1
"Kiddbuu",0,1,94938,Grievous,"zGG zB2 zB1 Droideka MagnaGuard",1
"Kiddbuu",1,1,110861,Revan Offense,"zzzJKR zGMY BS zJolee Ezra",1
"Kiddbuu",1,0,133309,ShaakClones,"zzShaak Ti, zRex Echo (501st), zzFives ARC Trooper",1
"Kiddbuu",1,1,83849,Ewoks,"zChirpa Elder Paploo Teebo G8, zWicket",1
"Kiddbuu",1,1,84800,Carth,"Carth Onasi G9, zMission zZaalbar Juhani Canderous",1
"Kiddbuu",0,1,109460,BH,"zzBossk Boba Jango zThe Mandalorian, zGreef Karga",1
"Kiddbuu",1,1,108453,zEP,"zzEP zzVader Tarkin TFP G9, Traya G8",1
"Kiddbuu",1,0,99211,CLS,"zzCLS zHan Wedge G8, Biggs zChewbacca",1
"Kiddbuu",0,1,80714,Phoenix,"Hera zZeb zKanan Sabine G8, Chopper",1
"Kiddbuu",1,0,14062,SionSolo (Counter),"Sion G8",1
"Kiddbuu",1,1,87962,NS,"MT zAV Daka Zombie Spirit",0
"Kiddbuu",1,0,84396,Troopers,"Veers zAdmiral Piett, Moff Gideon, Dark Trooper, Range Trooper",0
"Kiddbuu",,,69634,Mon Mothma,"zMon Mothma G8, Cassian G9, Chirrut G8, Pao G8, Hoth Rebel Scout G8",0
"Kiddbuu",1,0,69668,zMaul,"Darth Maul, Sidious Dooku Sith Marauder 4* G8, Nest G7",0
"Kiddbuu",,,57821,Iden Troopers,"Iden Versio 3* G8, Stormtrooper Snowtrooper G8, Magma 4* G7, DT 6* G8",0
"Clarkonium",,,123067,Phasma,"zPhasma zFOTP FOSFTP zFOST zKylo",1
"Clarkonium",1,1,157445,SL Kylo,"zzzzzzSL Kylo, zSith Trooper, zHux zzKRU zThrawn",1
"Clarkonium",0,1,133639,DRMalak,"zzzDR zHK-47 zBSF zzMalak Sith Empire Trooper",1
"Clarkonium",0,1,137069,padme,"zzPadme zGK zJKA zAhsoka zC-3PO",1
"Clarkonium",,,470747,Negotiator,"Negotiator HT Anakin's Eta-2 Starfighter, Umbaran Starfighter, Ahsoka Tano's Jedi Starfighter, BTL-B Y-wing Starfighter 6*, Clone Sergeant's ARC-170, Plo Koon's Jedi Starfighter",1
"Clarkonium",,,309202,HansMF,"Home One, Han's MF, Rebel Y-wing, Ghost Phantom Biggs X-wing, Cassian's U-wing, Wedge X-wing",1
"Clarkonium",0,1,87356,Geonosians,"zzGBA Sun Fac G8, Geo Soldier, Geo Spy, Poggle",1
"Clarkonium",0,1,109472,Grievous,"zzGG zB2 zB1 MagnaGuard zNute",1
"Clarkonium",1,1,91160,JTR,"zzJTR Scav Rey, BB-8 G8, zR2-D2 zFinn G9",1
"Clarkonium",1,1,144167,GAS,"zzzzGAS zRex zEcho (501st), zzFives zARC Trooper",1
"Clarkonium",1,1,120867,Revan Offense,"zzzJKR zGMY BS zJolee HYoda",1
"Clarkonium",1,1,84485,Ewoks,"zChirpa Elder Paploo Wicket Logray",1
"Clarkonium",1,1,89405,Carth,"Carth Onasi, zMission zZaalbar Juhani Canderous",1
"Clarkonium",0,1,102842,BH,"zBossk zBoba Cad G9, zJango zThe Mandalorian",1
"Clarkonium",1,1,117712,zEP,"zzEP zzzVader Tarkin TFP G9, zMara Jade, The Emperor's Hand 5*",1
"Clarkonium",1,0,127516,zMaul,"zDarth Maul, zSidious zDooku Sith Marauder, zNest",1
"Clarkonium",0,1,66263,Phoenix,"Hera G8, Ezra Zeb G8, Kanan G8, Sabine G8",1
"Clarkonium",1,0,93887,CLS,"zzzCLS zHan Leia G9, Old Ben G9, zChewbacca G9",1
"Clarkonium",1,0,14448,SionSolo (Counter),"Sion G8",1
"Clarkonium",,,262366,Malevolence,"Malevolence Hyena Bomber 5*, Vulture Droid 5*, Sun Fac SF, Soldier SF, Spy SF",0
"Clarkonium",1,1,78473,NS,"MT G8, zAV Daka Zombie G9, Spirit G8",0
"Clarkonium",1,0,88376,Troopers,"Veers zAdmiral Piett, Moff Gideon, Dark Trooper 6* G9, Range Trooper 6* G8",0
"Clarkonium",1,1,64258,Rogue1,"Jyn G8, Chirrut 5* G8, Baze G8, Cassian G9, K-2SO G8",0
"Clarkonium",1,0,59187,Jawas,"Nebit G7, Jawa Engineer 6* G8, Jawa Scavenger G7, Jawa G8, Dathcha G8",0
"OldRepublic",,,123442,Phasma,"zPhasma zFOTP FOSFTP zFOST zKylo",1
"OldRepublic",1,1,156396,SL Kylo,"zzzzzzSL Kylo, zSith Trooper, zHux zzKRU zzThrawn",1
"OldRepublic",1,1,113084,NestSisters,"zzAV zzMT zDaka Zombie zNest",1
"OldRepublic",0,1,137106,padme,"zzPadme zGK zJKA zAhsoka zzC-3PO",1
"OldRepublic",1,0,143968,CLS,"zzzCLS zHan zzChewbacca zzR2-D2 zzOld Ben",1
"OldRepublic",,,459825,HansMF,"Home One, Han's MF, Rebel Y-wing 6*, Bistan's U-wing, Phantom Ghost Cassian's U-wing, Wedge X-wing",1
"OldRepublic",0,1,98587,Geonosians,"zzGBA Sun Fac, Geo Soldier, Geo Spy, Poggle",1
"OldRepublic",0,1,112845,Grievous,"zzGG zB2 zB1 zMagnaGuard zNute",1
"OldRepublic",1,0,144097,Traya,"zzTraya zzDN zSion zDooku zzEP",1
"OldRepublic",1,1,135940,GAS,"zzzzGAS zRex zEcho (501st), zzFives zARC Trooper",1
"OldRepublic",1,1,84889,Ewoks,"zChirpa Elder Paploo Wicket Logray",1
"OldRepublic",0,1,151480,BH,"zzBossk zGreedo zBoba zzJango zDengar",1
