Player,Offense,Defense,GP,Name,Squad,Viable
"Slay",,,343794,HansMF,"Home One, Han's MF, Rebel Y-wing, Bistan's U-wing, Phantom Ghost Cassian's U-wing, Biggs X-wing",1
"Slay",0,1,100652,Geonosians,"zzGBA Sun Fac, Geo Soldier, Geo Spy, Poggle",1
"Slay",0,1,126205,Grievous,"zzGG zB2 zB1 MagnaGuard zNute",1
"Slay",,,90439,Mon Mothma,"zzMon Mothma, Biggs Hoth Rebel Scout, Cara Dune, Wedge",1
"Slay",,,135064,Disintegration,"Aurra zGreef Karga, zBoba zzBossk zThe Mandalorian",1
"Slay",1,1,148369,GAS,"zzzzGAS zRex zEcho (501st), zzFives zARC Trooper",1
"Slay",1,1,77333,Ewoks,"zChirpa G9, Elder Paploo Wicket G9, Logray G9",1
"Slay",1,1,85332,Carth,"Carth Onasi, Mission Zaalbar Juhani G8, Canderous",1
"Slay",0,1,134193,BH,"zzJango Cad zZam IG-88 zDengar",1
"Slay",1,1,119753,zEP,"zEP zzzVader Tarkin zDooku TFP",1
"Slay",0,1,73251,Phoenix,"Hera G8, Ezra Zeb G8, Kanan G8, Chopper G9",1
"Slay",1,0,20523,NestSolo (Counter),"zNest",1
"Slay",,,62718,Phasma,"Phasma G7, FOE 5* G8, FOO G8, KRU 6* G8, Kylo G8",0
"Slay",1,0,108349,Troopers,"zVeers zStarck Shoretrooper Dark Trooper 6* G9, zzAdmiral Piett",0
"Disappointingpadawan",0,1,125834,DRMalak,"zzzDR zzHK-47 zBSF zzMalak Sith Empire Trooper",1
"Disappointingpadawan",0,1,127248,padme,"zzPadme zGK zJKA zAhsoka zC-3PO",1
"Disappointingpadawan",,,395356,Negotiator,"Negotiator HT Anakin's Eta-2 Starfighter, Umbaran Starfighter, Ahsoka Tano's Jedi Starfighter, Clone Sergeant's ARC-170, Jedi Consular's Starfighter, Plo Koon's Jedi Starfighter",1
"Disappointingpadawan",0,1,96059,Geonosians,"zzGBA Sun Fac, Geo Soldier, Geo Spy, Poggle",1
"Disappointingpadawan",1,0,133481,CLS,"zzzCLS zHan zChewbacca zChewpio zR2-D2",1
"Disappointingpadawan",1,1,138355,GAS,"zzzzGAS zRex Echo (501st), zzFives zARC Trooper",1
"Disappointingpadawan",1,1,107750,Revan Offense,"zzzJKR GMY zBS zJolee zEzra",1
"Disappointingpadawan",1,1,86864,Carth,"zCarth Onasi, zMission zZaalbar Juhani Canderous",1
"Disappointingpadawan",0,1,99327,BH,"zBossk Greedo zBoba Cad Embo",1
"Disappointingpadawan",0,1,119659,FO,"zzKRU Kylo zHux FOE zFOST",1
"Disappointingpadawan",1,0,17989,NestSolo (Counter),"zNest",1
"Disappointingpadawan",1,0,15232,SionSolo (Counter),"Sion",1
"Disappointingpadawan",,,265027,HansMF,"Home One, Han's MF 5*, Rebel Y-wing 5*, Bistan's U-wing 4*, Phantom Ghost Cassian's U-wing, Wedge X-wing",0
"Disappointingpadawan",0,1,98530,Grievous,"GG zB2 zB1 MagnaGuard Nute",0
"Disappointingpadawan",0,1,55335,Phoenix,"Hera G8, Zeb G8, Kanan G8, Sabine 5* G4, Chopper G7",0
"Wcheck",0,1,120805,padme,"zzPadme zGK zJKA zAhsoka zC-3PO",1
"Wcheck",0,1,110766,DRMalak,"zzzDR zHK-47 zBSF zMalak Sith Empire Trooper",1
"Wcheck",,,363547,HansMF,"Home One, Han's MF 6*, Rebel Y-wing, Bistan's U-wing, Phantom Ghost Cassian's U-wing, Wedge X-wing",1
"Wcheck",,,465557,Negotiator,"Negotiator HT Anakin's Eta-2 Starfighter, Umbaran Starfighter, Ahsoka Tano's Jedi Starfighter, Clone Sergeant's ARC-170, Plo Koon's Jedi Starfighter, Rex's ARC-170",1
"Wcheck",0,1,96330,Geonosians,"zzGBA Sun Fac, Geo Soldier, Geo Spy, Poggle",1
"Wcheck",1,0,102148,Traya,"zzTraya zDN zSion zEP Thrawn",1
"Wcheck",,,105370,Nute-Wat,"zNute zB1 zB2 zMagnaGuard zWat Tambor G9",1
"Wcheck",1,0,117464,CLS,"zzzCLS zHan zzChewbacca zChewpio R2-D2",1
"Wcheck",1,1,148969,GAS,"zzzzGAS zRex Echo (501st), zzFives zARC Trooper",1
"Wcheck",1,1,115694,Revan Offense,"zzzJKR zGMY BS zJolee zzHYoda",1
"Wcheck",1,1,85673,Ewoks,"zChirpa Elder Paploo zWicket Logray",1
"Wcheck",0,1,91434,BH,"zBossk Boba Jango zThe Mandalorian, Dengar G9",1
"Wcheck",1,1,88169,Carth,"zCarth Onasi, zMission zZaalbar Juhani zCanderous",1
"Wcheck",0,1,87081,FO,"zKRU Kylo Sith Trooper, FOE FOO",1
"Wcheck",0,1,71123,Phoenix,"Hera G9, Ezra G9, Zeb G8, Kanan G8, Chopper G9",1
"Wcheck",1,0,19728,NestSolo (Counter),"zNest",1
"Wcheck",1,1,75044,NS,"MT G9, AV Daka Zombie 6* Spirit",0
"Wcheck",1,1,64131,Rogue1,"Jyn G8, Chirrut G8, Baze 5* G8, Cassian G9, K-2SO G8",0
"Lizard",1,1,160875,SL Kylo,"zzzzzzSL Kylo, zSith Trooper, zHux zzKRU zzThrawn",1
"Lizard",0,1,134108,padme,"zzPadme zGK zJKA zAhsoka zzC-3PO",1
"Lizard",1,0,133341,CLS,"zzzCLS zHan zzChewbacca zzR2-D2 zzOld Ben",1
"Lizard",,,455822,HansMF,"Home One, Han's MF, HT Bistan's U-wing, Phantom Ghost Cassian's U-wing, Wedge X-wing",1
"Lizard",0,1,99336,Geonosians,"zzGBA Sun Fac, Geo Soldier, Geo Spy, Poggle",1
"Lizard",0,1,127409,Grievous,"zzGG zB2 zB1 zMagnaGuard zNute",1
"Lizard",,,92071,Mon Mothma,"zzMon Mothma, Baze Scarif Hoth Rebel Scout, Bistan",1
"Lizard",1,1,150410,GAS,"zzzzGAS zRex zEcho (501st), zzFives zARC Trooper",1
"Lizard",1,1,83570,Ewoks,"zChirpa Elder zPaploo Scout zLogray",1
"Lizard",0,1,97550,BH,"zzBossk Greedo zBoba Cad zJango",1
"Lizard",1,1,104898,zEP,"zzEP zzzVader Tarkin DT TFP G8",1
"Lizard",0,1,91709,Phoenix,"zHera zEzra zZeb zKanan Chopper",1
"Lizard",,,120761,Phasma,"zPhasma zFOTP FOSFTP zFOST zKylo",0
"Lizard",,,290999,Malevolence,"Malevolence Hyena Bomber 4*, Vulture Droid 5*, Sun Fac SF, Soldier SF, Spy SF",0
"Lizard",1,1,100652,NS,"MT zzAV zDaka Zombie Spirit G6",0
"Lizard",1,0,56483,Troopers,"Veers Starck G7, Moff Gideon 4* G5, Stormtrooper G8, Snowtrooper G9",0
"Lizard",1,0,6630,SionSolo (Counter),"Sion G1",0
"Dagger",,,172631,JMLS,"zzzJKR zzJKL zzzzzzJMLS zHYoda zzzzGAS",1
"Dagger",0,1,135361,padme,"zzPadme zGK zJKA zAhsoka zC-3PO",1
"Dagger",0,1,112402,DRMalak,"zzzDR HK-47 zBSF zzMalak 6* Thrawn",1
"Dagger",,,473480,Negotiator,"Negotiator HT Anakin's Eta-2 Starfighter, Umbaran Starfighter, Ahsoka Tano's Jedi Starfighter, BTL-B Y-wing Starfighter, Clone Sergeant's ARC-170, Plo Koon's Jedi Starfighter",1
"Dagger",1,0,139808,CLS,"zzCLS zHan zChewbacca zzR2-D2 Old Ben",1
"Dagger",,,392100,HansMF,"Home One, Han's MF, Rebel Y-wing, Bistan's U-wing, Phantom Biggs X-wing, Cassian's U-wing, Wedge X-wing",1
"Dagger",0,1,92597,Geonosians,"zzGBA Sun Fac, Geo Soldier, Geo Spy, Poggle",1
"Dagger",0,1,112654,Grievous,"zzGG zB2 zB1 MagnaGuard zNute",1
"Dagger",,,102475,Disintegration,"Aurra zGreef Karga G8, Boba zzBossk zThe Mandalorian",1
"Dagger",,,105790,Mon Mothma,"zMon Mothma, Lando Biggs Hoth Rebel Scout, Wedge",1
"Dagger",1,1,76686,Ewoks,"zChirpa G8, Elder Paploo G9, Wicket Logray G9",1
"Dagger",1,0,139679,ShaakClones,"zzShaak Ti, zRex zEcho (501st), zzFives zARC Trooper",1
"Dagger",1,1,102642,zEP,"zEP zzzVader Tarkin TFP G9, zTraya",1
"Dagger",0,1,66753,Phoenix,"Hera G8, Ezra G8, Zeb G8, Kanan G8, Chopper G8",1
"Dagger",1,0,13006,SionSolo (Counter),"Sion G8",1
"Dagger",,,65348,Phasma,"Phasma G8, FOE G9, FOO G8, KRU G8, Kylo G8",0
"Dagger",,,296068,Malevolence,"Malevolence Hyena Bomber 6*, Vulture Droid, Sun Fac SF, Soldier SF, Spy SF",0
"Dagger",1,1,74532,NS,"MT G8, AV Daka G9, Zombie Spirit G8",0
"Dagger",1,0,83392,Troopers,"zVeers zzAdmiral Piett G9, zMoff Gideon G8, Dark Trooper G9, Range Trooper G9",0
"Dagger",1,1,82008,Carth,"Carth Onasi, Mission Zaalbar Juhani G7, Canderous",0
"Dagger",,,60690,Iden Troopers,"Iden Versio 5* G8, Stormtrooper G8, Snowtrooper G8, Magma G7, DT G8",0
"Dagger",0,1,84360,BH,"zJango Cad G8, zZam G9, IG-88 G8, Dengar G9",0
"Dagger",1,1,61582,Rogue1,"Jyn 6* G8, Chirrut G8, Baze 6* G8, Cassian G8, K-2SO G8",0
"Dagger",1,0,6693,NestSolo (Counter),"Nest G2",0
"Barbar Jinx",,,163092,JMK,"zzzzzzJMK zAhsoka zzzCAT zJKA zGK",1
"Barbar Jinx",,,172054,JMLS,"zzzJKR zzJKL zzzzzzJMLS zzHYoda zzzzGAS",1
"Barbar Jinx",0,1,145274,DRMalak,"zzzDR zzHK-47 zBSF zzMalak Sith Empire Trooper",1
"Barbar Jinx",,,483754,Negotiator,"Negotiator HT Anakin's Eta-2 Starfighter, Umbaran Starfighter, Ahsoka Tano's Jedi Starfighter, BTL-B Y-wing Starfighter, Clone Sergeant's ARC-170, Plo Koon's Jedi Starfighter",1
"Barbar Jinx",1,0,144855,CLS,"zzzCLS zHan zzChewbacca zzR2-D2 Old Ben",1
"Barbar Jinx",1,1,107554,NS_Alt,"zzMT zAV Talia Zombie zDaka",1
"Barbar Jinx",,,367085,HansMF,"Home One, Han's MF, Rebel Y-wing, Bistan's U-wing, Phantom Ghost Cassian's U-wing, Wedge X-wing",1
"Barbar Jinx",0,1,102530,Geonosians,"zzGBA Sun Fac, Geo Soldier, Geo Spy, Poggle",1
"Barbar Jinx",0,1,131192,Grievous,"zzGG zB2 zB1 zDroideka zMagnaGuard",1
"Barbar Jinx",,,105401,Mon Mothma,"Mon Mothma, Lando Biggs Cara Dune, Wedge",1
"Barbar Jinx",1,1,95692,Ewoks,"zChirpa Elder zPaploo zWicket zLogray",1
"Barbar Jinx",1,0,137483,ShaakClones,"zzShaak Ti, zRex zEcho (501st), zzFives zARC Trooper",1
"Barbar Jinx",0,1,134340,BH,"zzBossk zBoba Cad zJango zDengar",1
"Barbar Jinx",1,1,105305,Carth,"Carth Onasi, zMission zZaalbar zJuhani zCanderous",1
"Barbar Jinx",1,1,124826,zEP,"zzEP zzVader zTarkin Krennic TFP",1
"Barbar Jinx",0,1,96255,FO,"zzKRU zKylo FOE Phasma zFOTP",1
"Barbar Jinx",0,1,96254,Phoenix,"zHera zEzra zZeb zKanan Chopper",1
"Barbar Jinx",1,0,101406,zMaul,"Darth Maul, zSidious zDooku Sith Marauder, Nest G7",0
"Barbar Jinx",1,0,80797,Troopers,"Veers Starck Stormtrooper G8, Snowtrooper G8, Admiral Piett",0
"Barbar Jinx",1,0,65285,Jawas,"Nebit G8, Jawa Engineer G7, Jawa Scavenger G7, Jawa G8, Dathcha G9",0
"R2DQ",,,174082,JMK,"zzzzzzJMK zAhsoka zzzCAT zzzzGAS zGK",1
"R2DQ",,,120899,Phasma,"zPhasma FOTP FOSFTP zFOST zKylo",1
"R2DQ",1,1,154734,SL Kylo,"zzzzzzSL Kylo, zSith Trooper, zHux zzKRU zThrawn",1
"R2DQ",,,169082,SEE,"zzzzzzSEE zBSF zzMalak zzzDR zzzVader",1
"R2DQ",,,582277,Executor,"Executor HT Razor Crest, Xanadu Blood, Slave I, IG-2000 Imperial TIE Fighter, Tie Adv",1
"R2DQ",,,160227,JMLS,"zBS zzzzzzJMLS zWat Tambor, zzJKL zJolee",1
"R2DQ",1,1,111951,NestSisters,"zzAV zMT zDaka Zombie zNest",1
"R2DQ",,,512330,Negotiator,"Negotiator BTL-B Y-wing Starfighter, Anakin's Eta-2 Starfighter, Rex's ARC-170, Umbaran Starfighter, Ahsoka Tano's Jedi Starfighter, Plo Koon's Jedi Starfighter, Clone Sergeant's ARC-170",1
"R2DQ",1,0,151246,CLS,"zzzCLS zHan zzChewbacca zzR2-D2 zzOld Ben",1
"R2DQ",,,310952,Malevolence,"Malevolence Hyena Bomber, Vulture Droid, Sun Fac SF, Soldier SF, Spy SF",1
"R2DQ",,,460206,HansMF,"Home One, Han's MF, Rebel Y-wing, Bistan's U-wing, Phantom Ghost Cassian's U-wing, Wedge X-wing",1
"R2DQ",0,1,100273,Geonosians,"zzGBA Sun Fac, Geo Soldier, Geo Spy, Poggle",1
"R2DQ",0,1,125730,Grievous,"zzGG zB2 zB1 MagnaGuard zNute",1
"R2DQ",1,0,119688,Traya,"zzTraya zDN zSion zzEP Sith Empire Trooper",1
"R2DQ",,,115583,Mon Mothma,"zzMon Mothma, zPao Scarif Hoth Rebel Scout, zCara Dune",1
"R2DQ",1,0,131026,Troopers,"zVeers zzAdmiral Piett, zMoff Gideon, zDark Trooper, Range Trooper",1
"R2DQ",1,1,85465,Ewoks,"zChirpa Elder Paploo zWicket Logray",1
"R2DQ",1,0,147855,ShaakClones,"zzShaak Ti, zRex zEcho (501st), zzFives zARC Trooper",1
"R2DQ",0,1,142195,BH,"zzBossk zBoba Cad zJango Dengar",1
"R2DQ",1,1,104016,Carth,"zCarth Onasi, zMission zZaalbar zJuhani Canderous",1
"R2DQ",,,87464,Iden Troopers,"zIden Versio, Shoretrooper Snowtrooper Magma DT",1
"R2DQ",1,0,122906,Wiggs,"Wedge Biggs zFulcrum zzC-3PO zLeia",1
"R2DQ",0,1,91550,Phoenix,"Hera zEzra zZeb G8, Kanan Sabine",1
"R2DQ",1,1,95013,Rogue1,"Jyn Chirrut Baze Cassian K-2SO",1
"R2DQ",1,0,123843,zMaul,"zDarth Maul, zDooku zSidious Savage Sith Marauder",1
"R2DQ",1,0,71175,Jawas,"Nebit G8, Jawa Engineer G9, Jawa Scavenger G8, Jawa G9, Dathcha G9",1
"R2DQ",,,63031,Bad Batch,"zHunter 5* G9, zEcho 5* G9, Omega 5* G8, Tech 5* G9, zWrecker 6* G9",0
"MINI Origami Josh",,,168994,JMK,"zzzzzzJMK zAhsoka zzzCAT zzzzGAS zGK",1
"MINI Origami Josh",,,597094,Executor,"Executor HT Razor Crest, Xanadu Blood, Slave I, IG-2000 Imperial TIE Fighter, Tie Adv",1
"MINI Origami Josh",1,0,109654,CLS,"zzzCLS zHan zzChewbacca zR2-D2 Old Ben",1
"MINI Origami Josh",,,309489,Malevolence,"Malevolence Hyena Bomber, Vulture Droid, Sun Fac SF, Soldier SF, Spy SF",1
"MINI Origami Josh",,,297832,HansMF,"Home One, Han's MF, Rebel Y-wing 6*, Ghost Phantom Biggs X-wing, Cassian's U-wing, Wedge X-wing",1
"MINI Origami Josh",0,1,96592,Geonosians,"zzGBA Sun Fac, Geo Soldier, Geo Spy, Poggle",1
"MINI Origami Josh",0,1,126664,Grievous,"zzGG zB2 zB1 MagnaGuard zNute",1
"MINI Origami Josh",1,0,111490,Troopers,"zVeers zzAdmiral Piett, zMoff Gideon, Dark Trooper, Range Trooper",1
"MINI Origami Josh",1,1,79889,Ewoks,"zChirpa Elder Paploo G9, Wicket Logray",1
"MINI Origami Josh",1,0,149848,ShaakClones,"zzShaak Ti, zRex zEcho (501st), zzFives zARC Trooper",1
"MINI Origami Josh",0,1,142893,BH,"zzBossk zBoba Jango zIG-88 Dengar",1
"MINI Origami Josh",1,1,134416,zEP,"zzEP zzzVader Tarkin Krennic TFP",1
"MINI Origami Josh",0,1,112682,FO,"zzKRU zKylo G8, FOE zFOST FOO",1
"MINI Origami Josh",1,0,119275,zMaul,"zDarth Maul, zSidious Dooku Sith Marauder, Nest G9",1
"MINI Origami Josh",0,1,67626,Phoenix,"Hera G8, Ezra G8, Zeb G8, Kanan G8, Chopper G8",1
"MINI Origami Josh",1,0,12829,SionSolo (Counter),"Sion G8",1
"MINI Origami Josh",,,503085,Negotiator,"Negotiator BTL-B Y-wing Starfighter, Anakin's Eta-2 Starfighter, Rex's ARC-170 6*, Umbaran Starfighter, Ahsoka Tano's Jedi Starfighter, Plo Koon's Jedi Starfighter, Clone Sergeant's ARC-170",0
"MINI Origami Josh",1,1,95517,NS,"zMT zzAV zDaka Zombie Spirit G9",0
"MINI Origami Josh",,,62424,Mon Mothma,"Mon Mothma 4* G8, Cassian G9, K-2SO G8, Baze G8, Cara Dune G8",0
"MasterJackson",,,171147,JMK,"zzzzzzJMK zAhsoka zzzCAT zzzzGAS zGK",1
"MasterJackson",,,153785,JMLS,"zBS zzzzzzJMLS zWat Tambor, zzJKL zJolee",1
"MasterJackson",1,1,100430,NestSisters,"zzAV zzMT zDaka Zombie zNest",1
"MasterJackson",0,1,144442,DRMalak,"zzzDR zzHK-47 zBSF zzMalak Sith Marauder",1
"MasterJackson",1,0,148536,CLS,"zzzCLS zHan zzChewbacca zzR2-D2 zzOld Ben",1
"MasterJackson",,,530173,Negotiator,"Negotiator HT Anakin's Eta-2 Starfighter, Umbaran Starfighter, Ahsoka Tano's Jedi Starfighter, Clone Sergeant's ARC-170, Plo Koon's Jedi Starfighter, Rex's ARC-170",1
"MasterJackson",0,1,98416,Geonosians,"zzGBA Sun Fac, Geo Soldier, Geo Spy, Poggle",1
"MasterJackson",0,1,125031,Grievous,"zzGG zB2 zB1 zMagnaGuard zNute",1
"MasterJackson",1,0,133881,Traya,"zzTraya zzDN zSion zzEP zzThrawn",1
"MasterJackson",,,453078,Raddus,"Raddus 5* Sun Fac SF, Rey's Millennium Falcon, Poe Dameron's X-wing, Resistance X-wing, Biggs X-wing, Wedge X-wing, Phantom Ghost",1
"MasterJackson",,,104795,Mon Mothma,"zzMon Mothma, Chirrut Biggs Cara Dune, Wedge",1
"MasterJackson",1,1,89214,Ewoks,"zChirpa Elder zPaploo zWicket Logray G9",1
"MasterJackson",1,0,139436,ShaakClones,"zzShaak Ti, zRex zEcho (501st), zzFives zARC Trooper",1
"MasterJackson",0,1,123915,BH,"zzBossk zBoba Cad zzJango zDengar G9",1
"MasterJackson",1,1,96739,Carth,"zCarth Onasi, zMission zZaalbar zJuhani zCanderous",1
"MasterJackson",0,1,96074,FO,"zzKRU zKylo FOE Phasma FOO",1
"MasterJackson",0,1,83381,Phoenix,"Hera zEzra Zeb G8, Kanan G8, zSabine",1
"MasterJackson",1,0,107359,Troopers,"zVeers zStarck Shoretrooper G8, zzAdmiral Piett, zDT",0
"MasterJackson",1,0,69979,Jawas,"Nebit G8, Jawa Engineer G9, Jawa Scavenger G9, Jawa 6* G9, Dathcha G9",0
"Jay Blanks",,,168652,JMLS,"zzzJKR zzJKL zzzzzzJMLS zWat Tambor, zzzzGAS",1
"Jay Blanks",0,1,137077,padme,"zzPadme zGK zJKA zAhsoka zzC-3PO",1
"Jay Blanks",,,494650,Negotiator,"Negotiator HT Anakin's Eta-2 Starfighter, Umbaran Starfighter, Ahsoka Tano's Jedi Starfighter, BTL-B Y-wing Starfighter, Clone Sergeant's ARC-170, Plo Koon's Jedi Starfighter",1
"Jay Blanks",1,0,156870,CLS,"zzzCLS zHan zzChewbacca zzR2-D2 zzOld Ben",1
"Jay Blanks",,,439446,HansMF,"Home One, Han's MF, Rebel Y-wing, Bistan's U-wing, Phantom Ghost Cassian's U-wing, Wedge X-wing",1
"Jay Blanks",0,1,81959,Geonosians,"zGBA Sun Fac G9, Geo Soldier, Geo Spy, Poggle",1
"Jay Blanks",0,1,126524,Grievous,"zzGG zB2 zB1 zDroideka MagnaGuard",1
"Jay Blanks",,,100706,Mon Mothma,"zMon Mothma, Chirrut Biggs Cara Dune, Wedge",1
"Jay Blanks",,,110824,Nute-OR,"zNute zDooku zJango zZaalbar zMission",1
"Jay Blanks",1,1,95851,Ewoks,"zChirpa Elder zPaploo zWicket zLogray",1
"Jay Blanks",1,0,120650,ShaakClones,"zzShaak Ti, zRex zEcho (501st), zzFives zARC Trooper",1
"Jay Blanks",0,1,131194,BH,"zzBossk zBoba Cad zEmbo zDengar",1
"Jay Blanks",1,1,105810,zEP,"zzEP zzzVader Tarkin TFP zBSF",1
"Jay Blanks",0,1,99108,Phoenix,"zHera zEzra zZeb zKanan Sabine",1
"Jay Blanks",0,1,72576,FO,"zKRU Kylo G9, FOE G8, FOTP FOO G8",1
"Jay Blanks",1,0,60861,QiraNest,"Qira Nest zzHYoda",1
"Jay Blanks",1,0,14403,SionSolo (Counter),"Sion G8",1
"Jay Blanks",1,1,74896,NS,"MT G7, zzAV Daka G7, Zombie G7, Spirit G8",0
"Jay Blanks",,,319946,Executrix,"Executrix Tie Adv, Emperor's Shuttle, TIE Reaper 3*, Imperial TIE Fighter, Gauntlet Starfighter, First Order SF TIE Fighter, First Order TIE Fighter",0
"Jay Blanks",1,0,65093,Troopers,"Veers G8, Starck G7, Moff Gideon G7, Stormtrooper G8, Admiral Piett G7",0
"Jay Blanks",1,0,69545,Jawas,"Nebit G7, Jawa Engineer G9, Jawa Scavenger G7, Jawa Dathcha G8",0
"Hadōken",,,559252,Executor,"Executor 5* HT Razor Crest, Xanadu Blood, Slave I, IG-2000 Imperial TIE Fighter, Tie Adv",1
"Hadōken",,,162864,JMLS,"zzzJKR zzJKL zzzzzzJMLS zWat Tambor, zzzzGAS",1
"Hadōken",0,1,134751,padme,"zzPadme zGK zJKA zAhsoka zC-3PO",1
"Hadōken",0,1,127126,DRMalak,"zzzDR zzHK-47 zBSF zzMalak zThrawn",1
"Hadōken",,,462823,Negotiator,"Negotiator BTL-B Y-wing Starfighter, Anakin's Eta-2 Starfighter, Rex's ARC-170, Umbaran Starfighter, Ahsoka Tano's Jedi Starfighter, Plo Koon's Jedi Starfighter, Clone Sergeant's ARC-170",1
"Hadōken",1,0,145659,CLS,"zzzCLS zHan zzChewbacca zzR2-D2 zOld Ben",1
"Hadōken",,,306302,Malevolence,"Malevolence Hyena Bomber, Vulture Droid, Sun Fac SF, Soldier SF, Spy SF",1
"Hadōken",,,361438,HansMF,"Home One, Han's MF, Rebel Y-wing, Bistan's U-wing, Phantom Biggs X-wing, Cassian's U-wing, Wedge X-wing",1
"Hadōken",0,1,100811,Geonosians,"zzGBA Sun Fac, Geo Soldier, Geo Spy, Poggle",1
"Hadōken",0,1,114545,Grievous,"zzGG zB2 zB1 MagnaGuard zNute",1
"Hadōken",1,0,111345,Traya,"zzTraya zDN zSion zzEP zNest",1
"Hadōken",1,1,88945,Ewoks,"zChirpa Elder Paploo Wicket Logray",1
"Hadōken",1,0,134994,ShaakClones,"zzShaak Ti, zRex zEcho (501st), zzFives zARC Trooper",1
"Hadōken",0,1,133798,BH,"zzBossk Boba Cad IG-88 Dengar",1
"Hadōken",0,1,83407,FO,"zKRU zKylo FOE G9, zFOTP FOO G9",1
"Hadōken",0,1,74250,Phoenix,"Hera G9, Ezra Zeb G8, Kanan G8, Chopper",1
"Hadōken",1,1,76215,NS_Alt,"MT G8, zAV Talia G8, Zombie Daka G9",0
"Hadōken",1,0,100312,Troopers,"zVeers zzAdmiral Piett, Moff Gideon G9, zDark Trooper, Range Trooper G7",0
"Hadōken",,,109691,Mon Mothma,"zzMon Mothma, zKyle Katarn G9, Lando Biggs Wedge",0
"Hadōken",1,1,86386,Carth,"zCarth Onasi, zMission zZaalbar Juhani G7, zCanderous",0
"Hadōken",0,1,112926,BH,"zJango Greedo zThe Mandalorian, zZam zzGreef Karga",0
"Hadōken",,,65010,Bad Batch,"Hunter G9, Echo G8, Omega G8, Tech G8, Wrecker G8",0
"LordTak",,,170923,JMK,"zzzzzzJMK zAhsoka zzzCAT zzzzGAS zGK",1
"LordTak",1,1,157494,SL Kylo,"zzzzzzSL Kylo, zSith Trooper, zHux zzKRU zzThrawn",1
"LordTak",,,148302,SEE,"zzzzzzSEE zBSF zzMalak zzzDR zzzVader",1
"LordTak",0,1,87928,Qira,"Qira zL3-37 zVandor Chewbacca, zMission zZaalbar",1
"LordTak",1,1,107498,NS,"zzMT zzAV zDaka Zombie Spirit",1
"LordTak",,,593886,Executor,"Executor HT Razor Crest, Xanadu Blood, Slave I, IG-2000 Imperial TIE Fighter, Tie Adv",1
"LordTak",,,519278,Negotiator,"Negotiator BTL-B Y-wing Starfighter, Anakin's Eta-2 Starfighter, Rex's ARC-170, Umbaran Starfighter, Ahsoka Tano's Jedi Starfighter, Plo Koon's Jedi Starfighter, Clone Sergeant's ARC-170",1
"LordTak",1,0,150702,CLS,"zzzCLS zHan zzChewbacca zzR2-D2 zzOld Ben",1
"LordTak",,,322488,Malevolence,"Malevolence Hyena Bomber, Vulture Droid, Sun Fac SF, Soldier SF, Spy SF",1
"LordTak",,,470736,HansMF,"Home One, Han's MF, Rebel Y-wing, Bistan's U-wing, Phantom Ghost Cassian's U-wing, Wedge X-wing",1
"LordTak",0,1,104756,Geonosians,"zzGBA Sun Fac, Geo Soldier, Geo Spy, Poggle",1
"LordTak",0,1,123238,Grievous,"zzGG zB2 zB1 zMagnaGuard zNute",1
"LordTak",1,0,108073,Traya,"zzTraya zDN zSion zzEP Sith Empire Trooper G8",1
"LordTak",,,103090,Mon Mothma,"zzMon Mothma, Biggs Scarif Hoth Rebel Scout, Wedge",1
"LordTak",,,117052,Disintegration,"zAurra Greef Karga G9, zBoba zzBossk zThe Mandalorian",1
"LordTak",1,1,138753,Revan Offense,"zzzJKR zGMY zzHYoda zJolee zJKA",1
"LordTak",1,1,95069,Ewoks,"zChirpa Elder zPaploo zWicket zLogray",1
"LordTak",1,0,153185,ShaakClones,"zzShaak Ti, zRex zEcho (501st), zzFives zARC Trooper",1
"LordTak",0,1,132163,BH,"zzJango Cad zZam zIG-88 zDengar",1
"LordTak",1,0,120274,Troopers,"zVeers zStarck zStormtrooper Snowtrooper zzAdmiral Piett",1
"LordTak",0,1,101665,Phoenix,"zHera zEzra zZeb zKanan zSabine",1
"LordTak",1,1,96323,Rogue1,"zJyn Chirrut Baze zCassian zK-2SO",1
"LordTak",1,0,77750,Jawas,"Nebit Jawa Engineer, Jawa Scavenger, Jawa Dathcha",1
"LordTak",1,0,18660,NestSolo (Counter),"zNest",1
"LordTak",,,123666,Phasma,"zPhasma zFOTP FOSFTP zFOST zKylo",0
"LordTak",,,145784,JMLS,"zBS zzzzzzJMLS zWat Tambor, zzJKL zBarriss",0
"LordTak",1,0,120676,zMaul,"Darth Maul, zDooku zSidious Savage Sith Marauder",0
"choochoorenren123",1,1,127685,NS,"zzMT zzAV zDaka Zombie Spirit",1
"choochoorenren123",0,1,155320,padme,"zzPadme zGK zJKA zAhsoka zzC-3PO",1
"choochoorenren123",,,504405,Negotiator,"Negotiator HT Anakin's Eta-2 Starfighter, Umbaran Starfighter, Ahsoka Tano's Jedi Starfighter, BTL-B Y-wing Starfighter, Clone Sergeant's ARC-170, Plo Koon's Jedi Starfighter",1
"choochoorenren123",1,0,143803,CLS,"zzzCLS zHan zzChewbacca zzR2-D2 zzOld Ben",1
"choochoorenren123",0,1,121528,DR,"zzzDR zzHK-47 zBSF Sith Empire Trooper, Sith Assassin",1
"choochoorenren123",,,463536,HansMF,"Home One, Han's MF, Rebel Y-wing, Bistan's U-wing, Phantom Ghost Cassian's U-wing, Wedge X-wing",1
"choochoorenren123",0,1,107408,Geonosians,"zzGBA Sun Fac, Geo Soldier, Geo Spy, Poggle",1
"choochoorenren123",0,1,117278,Grievous,"zzGG zB2 zB1 zMagnaGuard zNute",1
"choochoorenren123",1,1,138434,GAS,"zzzzGAS zRex zEcho (501st), zzFives zARC Trooper",1
"choochoorenren123",1,1,147179,Revan Offense,"zzzJKR zzGMY zBS zJolee zzHYoda",1
"choochoorenren123",1,1,110587,Ewoks,"zChirpa Elder zPaploo zWicket zLogray",1
"choochoorenren123",0,1,131052,BH,"zzBossk zGreedo zBoba zzJango Dengar G8",1
"choochoorenren123",1,1,110001,Carth,"zCarth Onasi, zMission zZaalbar Juhani zCanderous",1
"choochoorenren123",1,1,128646,zEP,"zzEP zzzVader zzTarkin IPD G8, TFP",1
"choochoorenren123",0,1,104806,FO,"zzKRU zKylo zHux FOE FOO",1
"choochoorenren123",1,0,94454,Troopers,"zVeers zStarck Stormtrooper Snowtrooper zDT",1
"choochoorenren123",0,1,101595,Phoenix,"zHera zEzra zZeb zKanan zSabine",1
"choochoorenren123",1,1,96501,Rogue1,"zzJyn Chirrut Baze zCassian K-2SO",1
"choochoorenren123",1,0,130790,zMaul,"zDarth Maul, zDooku zzDN zSidious zSavage",1
"choochoorenren123",1,0,83335,Jawas,"Nebit Jawa Engineer, Jawa Scavenger, Jawa Dathcha",1
"choochoorenren123",1,0,21052,SionSolo (Counter),"zSion",1
"choochoorenren123",1,0,19452,NestSolo (Counter),"zNest",1
"choochoorenren123",,,290102,Malevolence,"Malevolence Hyena Bomber, Vulture Droid 4*, Sun Fac SF, Soldier SF, Spy SF",0
"choochoorenren123",,,460139,Executrix,"Executrix Tie Adv, Emperor's Shuttle, TIE Reaper 5*, Imperial TIE Fighter, Gauntlet Starfighter, First Order SF TIE Fighter, First Order TIE Fighter",0
"choochoorenren123",,,85864,Mon Mothma,"Mon Mothma 5* G8, Lando Biggs Wedge Hoth Rebel Soldier G9",0
"choochoorenren123",,,55078,Bad Batch,"Hunter 4* G8, Echo 5* G8, Omega 6* G8, Tech 3* G8, Wrecker G8",0
"Notlaw21",,,175864,JMLS,"zzzJKR zzJKL zzzzzzJMLS zWat Tambor, zzzzGAS",1
"Notlaw21",0,1,128021,DRMalak,"zzzDR zzHK-47 zBSF zzMalak Sith Empire Trooper",1
"Notlaw21",0,1,133284,padme,"zzPadme zGK zJKA zAhsoka C-3PO",1
"Notlaw21",1,0,141005,CLS,"zzzCLS zHan zChewbacca zR2-D2 Old Ben",1
"Notlaw21",,,425193,HansMF,"Home One, Han's MF, Rebel Y-wing, Bistan's U-wing, Phantom Biggs X-wing, Cassian's U-wing, Wedge X-wing",1
"Notlaw21",,,506956,Negotiator,"Negotiator HT Anakin's Eta-2 Starfighter, Umbaran Starfighter, Ahsoka Tano's Jedi Starfighter, Clone Sergeant's ARC-170, Plo Koon's Jedi Starfighter, Rex's ARC-170",1
"Notlaw21",0,1,90606,Geonosians,"zGBA Sun Fac, Geo Soldier, Geo Spy, Poggle",1
"Notlaw21",0,1,124649,Grievous,"zzGG zB2 zB1 MagnaGuard zNute",1
"Notlaw21",,,106862,Mon Mothma,"zzMon Mothma, Biggs Scarif Wedge Bistan",1
"Notlaw21",1,1,82746,Ewoks,"zChirpa Elder Paploo Wicket Logray",1
"Notlaw21",1,0,136846,ShaakClones,"zzShaak Ti, zRex zEcho (501st), zzFives ARC Trooper",1
"Notlaw21",0,1,139585,BH,"zzBossk Boba Cad zJango Dengar",1
"Notlaw21",1,1,83880,Carth,"Carth Onasi, Mission Zaalbar G9, Juhani zCanderous",1
"Notlaw21",1,1,107273,zEP,"zEP zzzVader Tarkin G8, TFP zTraya",1
"Notlaw21",0,1,88912,FO,"zzKRU Kylo FOE G9, FOST G8, FOO G9",1
"Notlaw21",0,1,68029,Phoenix,"Hera G9, Ezra Zeb G8, Kanan G8, Sabine G8",1
"Notlaw21",1,0,17233,NestSolo (Counter),"Nest",1
"Notlaw21",1,0,15928,SionSolo (Counter),"Sion",1
"Notlaw21",1,1,76191,NS,"MT G8, zzAV Daka G8, Zombie G8, Spirit G9",0
"Notlaw21",1,1,56285,Rogue1,"Jyn G8, Chirrut 6* G8, Baze G8, Cassian G8, K-2SO G8",0
"Caern Lewendail",,,170692,JMK,"zzzzzzJMK zAhsoka zzzCAT zzzzGAS zGK",1
"Caern Lewendail",,,173732,SEE,"zzzzzzSEE zBSF zzMalak zzzDR zzzVader",1
"Caern Lewendail",1,1,161293,GL Rey,"zzzzzzRey zzzJTR zzR2-D2 zHoldo zResistance Hero Finn",1
"Caern Lewendail",0,1,88838,Qira,"Qira G8, L3-37 zVandor Chewbacca, zMission zZaalbar",1
"Caern Lewendail",,,575833,Executor,"Executor HT Razor Crest, Xanadu Blood, Slave I, IG-2000 Imperial TIE Fighter, Tie Adv",1
"Caern Lewendail",,,155895,JMLS,"zBS zzzzzzJMLS zWat Tambor, zzJKL zJolee",1
"Caern Lewendail",1,1,105632,NestSisters,"zzAV zzMT zDaka Zombie zNest",1
"Caern Lewendail",,,503714,Negotiator,"Negotiator BTL-B Y-wing Starfighter, Anakin's Eta-2 Starfighter, Rex's ARC-170, Umbaran Starfighter, Ahsoka Tano's Jedi Starfighter, Plo Koon's Jedi Starfighter, Clone Sergeant's ARC-170",1
"Caern Lewendail",,,312989,Malevolence,"Malevolence Hyena Bomber, Vulture Droid, Sun Fac SF, Soldier SF, Spy SF",1
"Caern Lewendail",,,422133,HansMF,"Home One, Han's MF, Rebel Y-wing, Bistan's U-wing, Phantom Biggs X-wing, Cassian's U-wing, Wedge X-wing",1
"Caern Lewendail",0,1,100692,Geonosians,"zzGBA Sun Fac, Geo Soldier, Geo Spy, Poggle",1
