Player,Offense,Defense,GP,Name,Squad,Viable
"RobRem",0,1,143794,BH,"zzBossk zBoba Dengar IG-88 zzJango",1
"RobRem",0,1,77504,Phoenix,"Hera zEzra Zeb G8, Sabine Kanan G8",1
"RobRem",1,1,80912,Rogue1,"Jyn Chirrut Baze zCassian K-2SO G9",1
"RobRem",,,130566,Bad Batch,"zHunter zEcho zzOmega zTech zWrecker",1
"RobRem",1,0,19893,NestSolo (Counter),"zNest",1
"RobRem",,,453140,Executrix,"Executrix Tie Adv, Emperor's Shuttle, TIE Reaper, Imperial TIE Fighter, Gauntlet Starfighter, First Order SF TIE Fighter 5*, First Order TIE Fighter",0
"RobRem",1,1,88674,Carth,"zCarth Onasi, zMission zZaalbar Juhani G7, zCanderous",0
"RobRem",1,0,70148,Jawas,"Nebit Jawa Engineer, Jawa Scavenger G7, Jawa G8, Dathcha G8",0
"Pickle Rick",,,131525,Phasma,"zPhasma zFOTP FOSFTP zFOST zKylo",1
"Pickle Rick",1,1,164486,SL Kylo,"zzzzzzSL Kylo, zSith Trooper, zHux zzKRU Thrawn",1
"Pickle Rick",0,1,136187,padme,"zzPadme zGK zJKA zAhsoka C-3PO",1
"Pickle Rick",0,1,114076,Geonosians,"zzGBA Sun Fac, Geo Soldier, Geo Spy, Poggle",1
"Pickle Rick",1,1,125459,Ewoks,"zChirpa Elder zPaploo zWicket zLogray",1
"Pickle Rick",0,1,92206,BH,"zBossk Cad Boba Dengar G9, IG-88",1
"Pickle Rick",1,1,128206,zEP,"zzEP zzzVader Tarkin Krennic zTraya G9",1
"Pickle Rick",1,0,112436,Troopers,"zVeers Starck zAdmiral Piett, Moff Gideon, zDark Trooper",1
"Pickle Rick",0,1,79738,Phoenix,"Hera Ezra Zeb Sabine Kanan",1
"Pickle Rick",1,0,91072,Wampa (Counter),"Rex G8, zzWampa DT G8, HYoda FOO",1
"Pickle Rick",1,0,61102,Wiggs,"Wedge G8, Biggs CLS G8, Han G9, Leia G8",1
"Pickle Rick",,,416386,Negotiator,"Negotiator HT Anakin's Eta-2 Starfighter, Umbaran Starfighter 6*, Ahsoka Tano's Jedi Starfighter, BTL-B Y-wing Starfighter 2*, Clone Sergeant's ARC-170, Jedi Consular's Starfighter",0
"Pickle Rick",1,1,74713,NS,"MT G8, zAV Daka G9, Zombie Spirit G8",0
"Pickle Rick",,,85324,Nute-Wat,"Nute G6, zDooku zWat Tambor, Jango G8, Nest G7",0
"Pickle Rick",1,1,52276,Carth,"Carth Onasi 5* G7, Mission G9, Zaalbar G9, Juhani 4* G6, Canderous G7",0
"Pickle Rick",1,1,42263,Rogue1,"Jyn 6* G8, Chirrut 5* G8, Baze G8, Cassian 6* G8, K-2SO G8",0
"Pickle Rick",1,0,32489,Jawas,"Nebit G5, Jawa Engineer G5, Jawa Scavenger G5, Jawa 5* G8, Dathcha G5",0
"Pickle Rick",1,0,12714,SionSolo (Counter),"Sion G7",0
"MasterOogway",1,1,111449,Revan,"zzzJKR zBS GMY zJolee GK G8",1
"MasterOogway",0,1,99565,BH,"zzBossk Cad Boba zGreef Karga, Jango",1
"MasterOogway",0,1,133336,FO,"zzKRU zKylo zHux FOE FOO",1
"MasterOogway",0,1,68136,Phoenix,"Hera G8, Ezra G8, Zeb G8, Chopper G8, Kanan G8",1
"MasterOogway",1,0,74925,CLS,"CLS Han G9, Chewbacca G9, R2-D2 G9, Old Ben G9",0
"MasterOogway",0,1,76854,Geonosians,"zGBA 4* Sun Fac G8, Geo Soldier, Geo Spy, Poggle",0
"MasterOogway",1,1,33161,NS_Alt,"MT 5* G8, AV 5* G8, Talia 5* G8, Daka 5* G8, Spirit 5* G8",0
"MasterOogway",1,1,112321,zEP,"EP zzzVader Tarkin DT 5* zSith Trooper",0
"MasterOogway",1,0,55474,501st,"Rex G8, Clone Sergeant 6* G8, Echo (501st) G8, Fives G8, Ahsoka",0
"MasterOogway",1,0,42190,Wiggs,"Wedge 5* G8, Biggs 6* G8, Leia G9, Chirrut 5* G8, Baze 5* G8",0
"VoR",0,1,106449,DRMalak,"zzzDR HK-47 zBSF zzMalak Sith Empire Trooper",1
"VoR",0,1,88144,Geonosians,"zzGBA Sun Fac, Geo Soldier, Geo Spy, Poggle",1
"VoR",1,1,105866,Revan,"zzzJKR BS GMY zJolee zGK",1
"VoR",1,1,86970,Carth,"Carth Onasi, zMission zZaalbar Juhani Canderous",1
"VoR",0,1,103977,FO,"zzKRU zKylo zHux FOE G9, zFOST",1
"VoR",1,1,33161,NS_Alt,"MT 5* G8, AV 5* G8, Talia 5* G8, Daka 5* G8, Spirit 5* G8",0
"VoR",1,0,40571,501st,"Rex 6* G8, Clone Sergeant 5* G8, Echo (501st) 5* G8, Fives G8, Ahsoka G8",0
"VoR",0,1,42290,Phoenix,"Hera 5* G8, Zeb G8, Sabine 5* G8, Chopper G8, Kanan G8",0
"VoR",1,0,33161,Wiggs,"Wedge 5* G8, Biggs 5* G8, Leia 5* G8, Chirrut 5* G8, Baze 5* G8",0
"Pickle Rick jr",,,127625,Phasma,"zPhasma zFOTP FOSFTP zFOST zKylo",1
"Pickle Rick jr",1,1,154147,SL Kylo,"zzzzzzSL Kylo, zSith Trooper, zHux zzKRU Thrawn",1
"Pickle Rick jr",0,1,115093,Geonosians,"zzGBA Sun Fac, Geo Soldier, Geo Spy, Poggle",1
"Pickle Rick jr",0,1,72588,Phoenix,"Hera Ezra Zeb G8, Chopper Kanan G8",1
"Pickle Rick jr",1,1,84264,NS,"zzMT zAV zDaka G9, Zombie Spirit G9",0
"Pickle Rick jr",1,0,78574,Traya,"zTraya G6, DN 6* G8, Sion G1, zDooku G8, zzEP",0
"Pickle Rick jr",1,1,54261,Ewoks,"Chirpa G6, Elder 6* Paploo G5, Wicket 4* G5, Logray G6",0
"Pickle Rick jr",0,1,64918,BH,"Bossk Cad G8, Boba G9, IG-88 6* G8, Greedo 5* G8",0
"Pickle Rick jr",1,0,52970,501st,"Rex G8, Clone Sergeant G8, Echo (501st) 6* G8, Fives G8, Ahsoka",0
"Pickle Rick jr",1,0,73244,Wiggs,"Wedge 5* G8, Biggs 6* G8, zzzCLS Han Leia G8",0
"Pickle Rick jr",1,0,52837,Troopers,"Veers 6* Starck 6* G6, DT 6* G8, Snowtrooper 6* G8, Stormtrooper G9",0
"Pickle Rick jr",0,1,79539,BS,"BS G9, zGMY HYoda G8, GK JKA G9",0
"Pickle Rick jr",1,1,34853,Rogue1,"Jyn 5* G8, Chirrut 5* G8, Baze 6* G8, Cassian 5* G8, K-2SO 5* G8",0
"Chaytel",0,1,93488,Geonosians,"zzGBA Sun Fac, Geo Soldier, Geo Spy, Poggle",1
"Chaytel",0,1,103954,BH,"zzBossk Cad Boba zDengar zGreef Karga",1
"Chaytel",1,1,127689,zEP,"zzEP zzzVader Tarkin TFP zzMara Jade, The Emperor's Hand",1
"Chaytel",1,0,71516,Wiggs,"Wedge G8, Biggs G8, zHan Chewbacca G9, Ezra G9",1
"Chaytel",,,66167,Phasma,"Phasma G8, FOE G9, FOO G8, KRU G8, Kylo G8",0
"Chaytel",,,263961,HansMF,"Home One, Han's MF 5*, Biggs X-wing, Bistan's U-wing 4*, Phantom Ghost Cassian's U-wing, Wedge X-wing",0
"Chaytel",1,1,48396,NS_Alt,"MT 6* G8, AV G8, Talia G9, Daka G9, Spirit 6* G8",0
"Chaytel",1,0,56035,501st,"Rex G8, Clone Sergeant G8, Echo (501st) G8, Fives G8, Ahsoka",0
"Chaytel",0,1,68720,Phoenix,"Hera Zeb G8, Sabine 5* G8, Chopper Kanan G8",0
"Chaytel",1,1,51203,Rogue1,"Jyn 6* G8, Chirrut G8, Baze 6* G8, Cassian G8, K-2SO G8",0
