Player,Offense,Defense,GP,Name,Squad,Viable
"undead",0,1,106543,Geonosians,"zzGBA Sun Fac, Geo Soldier, Geo Spy, Poggle",1
"undead",,,324436,HansMF,"Home One, Han's MF 5*, HT Ghost Phantom Biggs X-wing, Cassian's U-wing, Wedge X-wing",1
"undead",1,0,94151,Troopers,"zVeers zAdmiral Piett, zzMoff Gideon, zDark Trooper, Range Trooper",1
"undead",1,0,112167,CLS,"zzzCLS zHan zzChewbacca zChewpio zzC-3PO",1
"undead",1,1,85640,Ewoks,"zChirpa Elder Paploo Wicket Logray",1
"undead",0,1,104162,BH,"zzBossk zJango Dengar G9, Cad Boba",1
"undead",1,1,96888,zEP,"zzEP zzVader zTarkin TFP G8, zzMara Jade, The Emperor's Hand 5*",1
"undead",0,1,68767,Phoenix,"Hera G9, Zeb G9, Ezra G9, Kanan G9, Chopper G9",1
"undead",,,57409,Phasma,"Phasma G8, FOTP FOSFTP G8, FOST 5* Kylo G9",0
"undead",1,1,58999,Revan Offense,"JKR G1, GMY G6, BS zJolee JKA G8",0
"undead",1,1,47549,NS_Alt,"MT G8, AV G8, Talia 6* G8, Spirit 6* G8, Daka G8",0
"undead",1,0,52432,501st,"Rex G8, ARC Trooper G8, Echo (501st) G8, Fives G8, Ahsoka G8",0
"undead",1,1,43677,Rogue1,"Jyn 5* G8, Chirrut 5* G8, Baze 6* G8, K-2SO G8, Cassian G8",0
"undead",1,0,10954,NestSolo (Counter),"Nest G4",0
"Bustaz",0,1,93182,Geonosians,"zzGBA Sun Fac, Geo Soldier, Geo Spy, Poggle",1
"Bustaz",0,1,97098,BH,"zzBossk Dengar Cad Greedo Boba",1
"Bustaz",1,0,68745,Wiggs,"Wedge G8, Biggs G8, CLS Han G9, Ezra G8",1
"Bustaz",,,66328,Phasma,"zPhasma G8, FOE FOO KRU G9, Kylo G8",0
"Bustaz",0,1,73953,padme,"zPadme GK 6* G9, JKA 6* Ahsoka Fives G7",0
"Bustaz",1,1,66671,JTR,"JTR G7, Scav Rey G8, BB-8 G9, R2-D2 G8, Finn G9",0
"Bustaz",1,1,37681,Ewoks,"Chirpa 5* G7, Elder 6* G8, Paploo 5* G7, Teebo G6, Scout G6",0
"Bustaz",1,1,72595,zEP,"zEP Vader Tarkin G8, Dooku 5* G8, TFP",0
"Zaknafien",0,1,96894,DRMalak,"zzzDR HK-47 zBSF zMalak Thrawn G8",1
"Zaknafien",0,1,92236,Geonosians,"zzGBA Sun Fac, Geo Soldier, Geo Spy, Poggle",1
"Zaknafien",1,1,101482,Revan,"zzzJKR BS zGMY zJolee GK",1
"Zaknafien",1,1,90426,Carth,"zCarth Onasi, zMission Zaalbar Juhani Canderous",1
"Zaknafien",0,1,80273,BH,"zBossk G9, Jango Dengar G8, Cad Boba",1
"Zaknafien",1,1,78184,zEP,"zzEP zzzVader G9, Tarkin G8, TFP G8, Traya G8",1
"Zaknafien",0,1,70807,Phoenix,"Hera G8, Zeb G8, Ezra G8, Kanan G9, Chopper",1
"Zaknafien",,,59427,Phasma,"Phasma G7, FOTP G7, FOO G8, KRU Kylo G8",0
"Zaknafien",,,291764,Negotiator,"Negotiator 5* BTL-B Y-wing Starfighter 4*, Anakin's Eta-2 Starfighter 6*, Rex's ARC-170 6*, Umbaran Starfighter 6*, Ahsoka Tano's Jedi Starfighter, Plo Koon's Jedi Starfighter, Clone Sergeant's ARC-170",0
"Zaknafien",1,0,68241,CLS,"CLS Han G8, Chewbacca 5* G8, R2-D2 G9, Stormtrooper Han",0
"Zaknafien",0,1,61818,Grievous,"GG G7, B2 G2, MagnaGuard G9, IG-88 T3-M4",0
"Zaknafien",1,1,75588,Ewoks,"zChirpa G8, Elder Paploo Wicket Logray 6*",0
"Zaknafien",1,0,73816,ShaakClones,"Shaak Ti 5* G9, Rex Echo (501st), Fives G9, ARC Trooper G9",0
"Keegstone",1,1,127639,Revan Offense,"zzzJKR zGMY zBS zJolee Ezra",1
"Keegstone",1,1,96879,Carth,"zCarth Onasi, zMission zZaalbar Juhani zCanderous",1
"Keegstone",1,1,91613,zEP,"zEP zzVader Tarkin G8, zBSF DN G9",1
"Keegstone",1,0,79283,QGJ,"zQGJ Aayla JKA G9, Old Ben, Ahsoka",1
"Keegstone",,,38213,Phasma,"Phasma G8, FOE 5* G8, FOO 5* G8, KRU 5* G8, Kylo 6* G8",0
"Keegstone",1,0,75892,Troopers,"Veers Admiral Piett G9, Moff Gideon, Dark Trooper, Range Trooper G8",0
"Keegstone",1,1,40603,NS_Alt,"MT 5* G8, AV G8, Talia 5* G8, Spirit 5* G8, Daka G9",0
"Keegstone",0,1,77542,BH,"Bossk 6* Jango Dengar G9, Cad G9, Boba",0
"Keegstone",1,0,51231,Wiggs,"Wedge 5* G8, Biggs G8, CLS G8, Han G1, Leia G9",0
"Keegstone",1,0,61198,Rex (Counter),"Rex G8, zWampa Chirrut 5* G8, Baze 6* G8, R2-D2 G8",0
"Keegstone",0,1,59966,Phoenix,"Hera G8, Zeb G9, Sabine 5* G8, Kanan G9, Chopper G8",0
"Keegstone",1,0,6630,SionSolo (Counter),"Sion G1",0
"MillennialFulcrum",0,1,146453,padme,"zzPadme zGK zJKA zAhsoka zzC-3PO",1
"MillennialFulcrum",0,1,100033,Geonosians,"zzGBA Sun Fac, Geo Soldier, Geo Spy, Poggle",1
"MillennialFulcrum",1,1,100208,Ewoks,"zChirpa Elder zPaploo zWicket zLogray",1
"MillennialFulcrum",1,0,113827,ShaakClones,"zShaak Ti, zRex zEcho (501st), zzFives zARC Trooper",1
"MillennialFulcrum",0,1,74312,Phoenix,"Hera G8, Zeb G9, Sabine Ezra G8, Kanan G9",1
"MillennialFulcrum",1,1,131811,zEP,"zzEP zzzVader zTarkin zDooku TFP G9",1
"MillennialFulcrum",,,494575,Negotiator,"Negotiator BTL-B Y-wing Starfighter 3*, Anakin's Eta-2 Starfighter, Rex's ARC-170, Umbaran Starfighter, Ahsoka Tano's Jedi Starfighter, Plo Koon's Jedi Starfighter, Clone Sergeant's ARC-170",0
"MillennialFulcrum",1,1,83070,NS_Alt,"zzAV Talia G8, Spirit G9, Daka Zombie",0
"MillennialFulcrum",0,1,89292,Grievous,"GG G3, zB2 zB1 6* zMagnaGuard G9, zNute",0
"MillennialFulcrum",,,44694,Mon Mothma,"Mon Mothma 4* G8, Biggs G4, K-2SO G7, Hoth Rebel Scout G7, Cassian G7",0
"MillennialFulcrum",1,0,95082,Troopers,"zVeers zStarck zzMoff Gideon 4* G7, zzAdmiral Piett, Stormtrooper G9",0
"Francescoo7",0,1,83602,Geonosians,"zGBA Sun Fac G9, Geo Soldier, Geo Spy, Poggle",1
"Francescoo7",1,1,100277,Revan Offense,"zzJKR GMY BS zJolee JKA",1
"Francescoo7",0,1,103820,BH,"zzBossk Jango zGreef Karga, Boba zZam",1
"Francescoo7",0,1,70092,Phoenix,"Hera Zeb G8, Ezra G9, Kanan G8, Chopper",1
"Francescoo7",,,71463,Phasma,"Phasma FOE FOO G8, zKRU Kylo G7",0
"Francescoo7",1,0,83954,CLS,"zCLS Han zChewbacca R2-D2 G9, Stormtrooper Han G9",0
"Francescoo7",,,71250,Mon Mothma,"zMon Mothma, Kyle Katarn 4*, Hoth Rebel Scout, Pao Cara Dune",0
"Francescoo7",1,1,63239,Ewoks,"Chirpa G9, Elder zPaploo Teebo G8, Scout G8",0
"Francescoo7",1,0,53312,501st,"Rex G8, Clone Sergeant G6, Echo (501st) G7, Fives G9, Ahsoka",0
"Titan115",0,1,101905,padme,"zzPadme GK zJKA Ahsoka zC-3PO",1
"Titan115",0,1,91795,Geonosians,"zGBA Sun Fac, Geo Soldier, Geo Spy, Poggle",1
"Titan115",1,0,118421,CLS,"zzzCLS zHan zzChewbacca zChewpio R2-D2",1
"Titan115",1,1,104347,Revan Offense,"zzzJKR zGMY zBS zJolee Ezra",1
"Titan115",1,1,84799,Ewoks,"zChirpa Elder zPaploo Wicket Logray",1
"Titan115",0,1,89779,BH,"zBossk Jango Cad Boba Zam",1
"Titan115",1,0,74618,ShaakClones,"Shaak Ti G9, Rex Echo (501st), Fives G9, ARC Trooper G9",0
"Titan115",1,1,118745,zEP,"zEP zzzVader Tarkin Dooku Krennic G1",0
"ddtorch",0,1,93436,Geonosians,"zzGBA Sun Fac, Geo Soldier, Geo Spy, Poggle",1
"ddtorch",1,1,88346,Ewoks,"zChirpa Elder Paploo zWicket zLogray",1
"ddtorch",0,1,85859,BH,"zBossk zJango The Mandalorian G9, Greef Karga G9, Boba",1
"ddtorch",0,1,122002,FO,"zzKRU Kylo zHux FOST FOE",1
"ddtorch",0,1,76497,padme,"Padme GK JKA Ahsoka C-3PO",0
"ddtorch",1,0,93061,CLS,"zCLS zHan zChewbacca R2-D2 G8, Stormtrooper Han G8",0
"ddtorch",0,1,84464,DR,"DR HK-47 G9, zBSF Sith Marauder, Sith Empire Trooper G9",0
"ddtorch",0,1,61640,Grievous,"zzGG B2 G2, B1 G5, MagnaGuard G4, Nute",0
"ddtorch",1,1,84381,Revan Offense,"zJKR GMY BS G9, zJolee Ezra G8",0
"ddtorch",1,1,61483,Carth,"Carth Onasi G9, Mission G8, Zaalbar G8, Juhani G7, Canderous G8",0
"ddtorch",1,1,98509,zEP,"EP zzVader Tarkin G8, Dooku G9, zSith Trooper",0
"ddtorch",0,1,53340,Phoenix,"Hera G7, Zeb G7, Sabine 6* G7, Kanan G7, Chopper G7",0
"DarthVikingz",0,1,138504,DRMalak,"zzzDR zzHK-47 zBSF zzMalak Sith Empire Trooper",1
"DarthVikingz",0,1,113897,padme,"zzPadme zGK zJKA zAhsoka zC-3PO",1
"DarthVikingz",0,1,105068,Geonosians,"zzGBA Sun Fac, Geo Soldier, Geo Spy, Poggle",1
"DarthVikingz",1,1,144459,GAS,"zzzzGAS zRex zEcho (501st), zzFives zARC Trooper",1
"DarthVikingz",1,1,95967,Revan Offense,"zzzJKR zGMY BS zJolee Ezra G9",1
"DarthVikingz",1,1,70303,Ewoks,"zChirpa G9, Elder Paploo G9, Wicket G9, Logray G9",1
"DarthVikingz",1,1,88023,Carth,"Carth Onasi, zMission zZaalbar Juhani zCanderous",1
"DarthVikingz",0,1,105602,FO,"zKRU Kylo zHux FOO FOE",1
"DarthVikingz",,,404779,Negotiator,"Negotiator 5* BTL-B Y-wing Starfighter 3*, Anakin's Eta-2 Starfighter, Rex's ARC-170 6*, Umbaran Starfighter, Ahsoka Tano's Jedi Starfighter, Plo Koon's Jedi Starfighter, Clone Sergeant's ARC-170",0
"DarthVikingz",0,1,90425,Grievous,"GG G8, zB2 zB1 MagnaGuard Nute",0
"DarthVikingz",1,0,85161,Traya,"zTraya G7, DN 5* G8, Sion 3* G6, zzEP Thrawn",0
"DarthVikingz",1,1,59895,NS,"MT 5* G8, zAV Daka G8, Zombie 6* G8, Spirit G8",0
"DarthVikingz",0,1,59456,BH,"Bossk 5* G8, Jango G7, Cad G8, Greedo G8, Boba G8",0
"DarthVikingz",1,0,52549,Troopers,"Veers 5* G8, Starck G5, Snowtrooper G8, Shoretrooper Range Trooper G6",0
"DarthVikingz",0,1,58257,Phoenix,"Hera G9, Zeb G8, Sabine 5* G8, Kanan G8, Chopper G9",0
"DarthVikingz",1,0,42952,Wiggs,"Wedge 5* G8, Biggs G8, Leia G8, Chirrut 5* G8, Baze 5* G8",0
"stryderjzw",0,1,96877,Geonosians,"zzGBA Sun Fac, Geo Soldier, Geo Spy, Poggle",1
"stryderjzw",1,0,117426,CLS,"zzzCLS zHan zChewbacca zChewpio zR2-D2",1
"stryderjzw",0,1,116039,BH,"zBossk Dengar The Mandalorian, Boba IG-88",1
"stryderjzw",1,1,100057,zEP,"zEP zVader Tarkin Dooku G8, TFP",1
"stryderjzw",0,1,66553,Phoenix,"Hera G8, Zeb G8, Ezra Kanan G8, Chopper G8",1
"stryderjzw",0,1,99594,padme,"zzPadme zGK zJKA zAhsoka Fives G8",1
"stryderjzw",,,32609,Phasma,"Phasma 5* G8, FOE 5* G8, FOO 5* G8, KRU 5* G8, Kylo 5* G8",0
"stryderjzw",,,289296,HansMF,"Home One, Han's MF 6*, HT Ghost 6* Phantom 6* Biggs X-wing 5*, Cassian's U-wing, Wedge X-wing 6*",0
"stryderjzw",0,1,63085,Grievous,"zGG B2 5* G8, B1 5* G8, MagnaGuard G8, Nute G9",0
"stryderjzw",1,1,72617,Revan Offense,"JKR G9, GMY BS G9, Jolee G8, HYoda 5* G9",0
"stryderjzw",1,1,33161,NS_Alt,"MT 5* G8, AV 5* G8, Talia 5* G8, Spirit 5* G8, Daka 5* G8",0
"stryderjzw",1,1,68234,Ewoks,"zChirpa G8, Elder Paploo G9, Wicket 6* G8, Logray G9",0
"stryderjzw",1,0,43099,Wiggs,"Wedge 5* G8, Biggs G8, Leia G9, Chirrut 5* G8, Baze 5* G8",0
"Ct5555",0,1,99502,Geonosians,"zzGBA Sun Fac, Geo Soldier, Geo Spy, Poggle",1
"Ct5555",0,1,91081,Grievous,"zzGG zB2 G9, zB1 G9, zDroideka G9, zMagnaGuard G9",1
"Ct5555",1,1,103258,Revan Offense,"zzzJKR zGMY zBS zJolee Ezra",1
"Ct5555",1,0,120608,ShaakClones,"zzShaak Ti, zRex zEcho (501st), zzFives zARC Trooper",1
"Ct5555",1,1,97956,Carth,"zCarth Onasi, zMission zZaalbar zJuhani zCanderous",1
"Ct5555",0,1,87246,BH,"zzBossk Jango G8, The Mandalorian G8, zGreef Karga G8, Boba G9",1
"Ct5555",1,1,70944,zEP,"EP G9, Vader Tarkin G7, zBSF DN 3* G5",0
"Ct5555",0,1,64534,Phoenix,"Hera G9, Zeb G8, Sabine 5* G8, Kanan G8, Chopper G8",0
"Paleguy",,,127255,Phasma,"zPhasma FOE Sith Trooper, zzKRU Kylo",1
"Paleguy",0,1,77607,Geonosians,"zGBA Sun Fac G8, Geo Soldier, Geo Spy G8, Poggle",1
"Paleguy",0,1,78638,Grievous,"zzGG B2 G9, MagnaGuard G9, Dooku G8, IG-88",1
"Paleguy",1,1,81549,Carth,"zCarth Onasi, zMission Zaalbar Juhani Canderous G8",1
"Paleguy",1,1,74748,Ewoks,"zChirpa Elder Paploo Teebo G9, Scout G8",1
"Paleguy",1,1,100977,zEP,"zzEP zVader Tarkin G8, BSF zDN",1
"Paleguy",0,1,61446,Phoenix,"Hera G8, Zeb G8, Ezra G8, Kanan G8, Chopper G8",1
"Paleguy",0,1,78538,BS,"zBS GMY G9, Jolee Old Ben G9, JKA",1
"Paleguy",1,0,79298,CLS,"zzCLS Han G9, Chewbacca 5* G9, R2-D2 G8, Stormtrooper Han G9",0
"Paleguy",,,226394,HansMF,"Home One 6*, Han's MF 5*, Rebel Y-wing 5*, Ghost Phantom Biggs X-wing, Cassian's U-wing, Wedge X-wing",0
"Paleguy",1,1,50326,NS,"MT G8, AV Daka G8, Zombie 6* G5, Spirit 6* G8",0
"Paleguy",0,1,76160,BH,"Bossk G9, Jango G9, The Mandalorian G9, Greef Karga G9, Boba G9",0
"Paleguy",1,0,60873,501st,"Rex G8, Clone Sergeant G8, Echo (501st) G8, Fives G8, Ahsoka G8",0
"Paleguy",1,1,41123,Rogue1,"Jyn 5* G8, Chirrut G8, Baze 6* G8, K-2SO G8, Cassian 5* G8",0
"Stormcrow",0,1,119914,padme,"zzPadme zGK zJKA zAhsoka zC-3PO",1
"Stormcrow",0,1,98814,Geonosians,"zzGBA Sun Fac, Geo Soldier, Geo Spy, Poggle",1
"Stormcrow",1,0,113270,CLS,"zzzCLS zHan zChewbacca Chewpio G8, R2-D2 G9",1
"Stormcrow",1,1,82145,Ewoks,"zChirpa Elder Paploo Scout Wicket",1
"Stormcrow",0,1,118459,BH,"zzBossk zKrrsantan Dengar G8, Greedo zBoba",1
"Stormcrow",0,1,83391,Phoenix,"zHera Zeb G8, Sabine Ezra zKanan",1
"Stormcrow",,,32609,Phasma,"Phasma 5* G8, FOE 5* G8, FOO 5* G8, KRU 5* G8, Kylo 5* G8",0
"Stormcrow",,,306897,HansMF,"Home One, Han's MF, Rebel Y-wing 4*, Ghost Phantom Biggs X-wing, Cassian's U-wing 5*, Wedge X-wing",0
"Stormcrow",0,1,72092,Grievous,"GG G8, B2 B1 Droideka MagnaGuard",0
"Stormcrow",1,1,54103,NS,"MT G8, AV Daka G9, Zombie 6* G8, Spirit 5* G8",0
"Stormcrow",1,0,60651,ShaakClones,"zShaak Ti, Rex 5* G8, Echo (501st) 5* G8, Fives Clone Sergeant",0
"Stormcrow",1,1,77919,zEP,"EP zzVader Tarkin DN 5* G8, Mara Jade, The Emperor's Hand 5* G8",0
"Stormcrow",0,1,74807,BH,"Jango G8, Fennec Shand G9, Cad The Mandalorian G9, IG-88",0
"Stormcrow",1,1,47192,Rogue1,"Jyn 6* G8, Chirrut 5* G8, Baze 6* G8, K-2SO G8, Cassian G8",0
"Merovecht",0,1,115762,DRMalak,"zzDR HK-47 zBSF zzMalak Sith Empire Trooper G8",1
"Merovecht",0,1,118467,padme,"zzPadme zGK zJKA zAhsoka C-3PO",1
"Merovecht",,,387127,Negotiator,"Negotiator 5* HT Anakin's Eta-2 Starfighter, Umbaran Starfighter, Ahsoka Tano's Jedi Starfighter, BTL-B Y-wing Starfighter 6*, Clone Sergeant's ARC-170, Plo Koon's Jedi Starfighter",1
"Merovecht",0,1,108392,Geonosians,"zzGBA Sun Fac, Geo Soldier, Geo Spy, Poggle",1
"Merovecht",1,1,82349,Ewoks,"zChirpa Elder Paploo Wicket Logray",1
"Merovecht",0,1,66550,Phoenix,"Hera G8, Zeb G8, Ezra Kanan G8, Chopper G8",1
"Merovecht",,,45448,Phasma,"Phasma G8, FOTP G8, FOSFTP G7, FOST 5* G8, Kylo 6* G8",0
"Merovecht",0,1,87230,Grievous,"GG G9, B2 zB1 zDroideka MagnaGuard G9",0
"Merovecht",1,0,53681,Troopers,"Veers Admiral Piett G7, Moff Gideon G8, Dark Trooper G8, Range Trooper G7",0
"Merovecht",1,1,55137,NS_Alt,"MT 6* G9, AV Talia 6* G8, Spirit G8, Daka G9",0
"Merovecht",1,0,95884,ShaakClones,"zShaak Ti, Rex Echo (501st), zFives ARC Trooper",0
"Merovecht",1,1,75007,Carth,"Carth Onasi, Mission Zaalbar Juhani G7, Canderous",0
"Merovecht",1,1,67418,zEP,"EP Vader Tarkin G8, TFP G8, Mara Jade, The Emperor's Hand 6* G8",0
"Merovecht",0,1,72725,BH,"Bossk Cad Greedo 6* G8, Boba IG-88 G8",0
"Merovecht",1,1,37988,Rogue1,"Jyn 5* G8, Chirrut 5* G8, Baze 6* G8, K-2SO G8, Cassian 5* G8",0
"Merovecht",1,0,6177,NestSolo (Counter),"Nest 5* G7",0
"DarkHope17",0,1,130615,DRMalak,"zzzDR HK-47 zBSF zzMalak Sith Empire Trooper",1
"DarkHope17",0,1,100734,Geonosians,"zzGBA Sun Fac, Geo Soldier, Geo Spy, Poggle",1
"DarkHope17",,,368416,HansMF,"Home One, Han's MF 6*, HT Ghost Phantom Biggs X-wing, Cassian's U-wing, Wedge X-wing",1
"DarkHope17",1,1,117842,Revan Offense,"zzzJKR zGMY zBS zJolee JKA",1
"DarkHope17",1,1,86064,Ewoks,"zChirpa Elder Paploo Wicket Logray",1
"DarkHope17",0,1,105399,BH,"zzBossk Jango Dengar G9, Boba IG-88",1
"DarkHope17",1,1,84175,Carth,"Carth Onasi, Mission Zaalbar Juhani G9, Canderous",1
"DarkHope17",1,1,108141,zEP,"zzEP zzzVader Tarkin G8, DT TFP",1
"DarkHope17",0,1,75744,Phoenix,"Hera G9, Zeb G9, Sabine G9, Ezra Kanan G9",1
"DarkHope17",1,0,81351,Wiggs,"Wedge G9, Biggs zCLS Han Chewbacca",1
"DarkHope17",,,39281,Phasma,"Phasma G8, FOE 5* G8, FOO 6* G8, KRU 5* G8, Kylo 5* G8",0
"DarkHope17",1,0,60976,Troopers,"Veers G9, Admiral Piett, Moff Gideon 6* G9, Dark Trooper 6* G9, Range Trooper 6* G8",0
"DarkHope17",1,1,52049,NS_Alt,"MT G8, AV G9, Talia G8, Spirit G9, Daka G8",0
"DarkHope17",1,0,48246,ShaakClones,"Shaak Ti G1, Rex G8, Echo (501st) G8, Fives G8, Clone Sergeant G8",0
"DarkHope17",1,1,62425,Rogue1,"Jyn G8, Chirrut G8, Baze 6* G8, K-2SO G8, Cassian G8",0
"ApexJoker",0,1,89974,Geonosians,"zzGBA Sun Fac, Geo Soldier, Geo Spy, Poggle",1
"ApexJoker",0,1,136302,FO,"zzKRU zKylo zHux zFOST FOE",1
"ApexJoker",0,1,65098,Phoenix,"Hera G8, Zeb G8, Ezra Kanan G8, Chopper G8",1
"ApexJoker",0,1,75092,padme,"zPadme 6* GK G8, JKA Ahsoka Fives",1
"ApexJoker",1,1,33750,Ewoks,"Chirpa 5* G8, Elder 6* G8, Paploo 5* G9, Wicket 5* G8, Logray 5* G8",0
"ApexJoker",1,1,97972,zEP,"EP zzVader Tarkin G8, TFP G8, zSith Trooper",0
"ApexJoker",0,1,54806,BH,"Bossk 5* G9, Dengar 6* G4, Cad G9, Boba G9, IG-88 G1",0
"brothers of arms and unknown",0,1,92068,Geonosians,"zzGBA Sun Fac, Geo Soldier, Geo Spy, Poggle",1
"brothers of arms and unknown",0,1,131148,FO,"zzKRU zKylo zHux zFOST FOE",1
"brothers of arms and unknown",0,1,72300,Phoenix,"Hera G9, Zeb G9, Ezra Kanan G8, Chopper",1
"brothers of arms and unknown",1,0,19471,SionSolo (Counter),"zSion",1
"brothers of arms and unknown",0,1,57563,Grievous,"zGG G9, B2 6* G7, B1 3* G7, MagnaGuard G7, Nute G5",0
"brothers of arms and unknown",1,1,97336,zEP,"zzEP zzzVader Tarkin G7, zSith Trooper, BSF 3* G6",0
"brothers of arms and unknown",0,1,71943,BH,"Bossk 4* G9, Jango G9, Embo 5* G9, The Mandalorian 4*, zBoba",0
"brothers of arms and unknown",1,0,54969,501st,"Rex G4, Clone Sergeant G8, Echo (501st) G3, Fives G4, Ahsoka G7",0
"brothers of arms and unknown",1,0,15001,NestSolo (Counter),"zNest 4*",0
"Rogue66697",0,1,121151,Geonosians,"zzGBA Sun Fac, Geo Soldier, Geo Spy, Poggle",1
"Rogue66697",,,283433,HansMF,"Home One, Han's MF 5*, HT Ghost Phantom Biggs X-wing, Cassian's U-wing, Wedge X-wing",1
"Rogue66697",0,1,81091,Grievous,"zzGG B2 G8, B1 Droideka G9, zMagnaGuard G9",1
"Rogue66697",1,1,97569,Ewoks,"zChirpa Elder zPaploo zWicket zLogray G9",1
"Rogue66697",1,1,134993,Carth,"zCarth Onasi, zMission zZaalbar zJuhani zCanderous",1
"Rogue66697",0,1,117958,BH,"zzBossk zzJango Cad zzThe Mandalorian, zBoba",1
"Rogue66697",0,1,83230,Phoenix,"Hera G8, Zeb G8, zSabine Ezra Kanan G8",1
"Rogue66697",,,62481,Phasma,"Phasma G7, FOTP G6, FOSFTP G4, FOST 4* G6, zKylo",0
"Rogue66697",0,1,101358,padme,"Padme G8, zGK zJKA zAhsoka CW Chewbacca G8",0
"Rogue66697",1,0,84233,Traya,"zTraya G8, zDN G9, Sion 5* G5, zBSF zDooku",0
"Rogue66697",1,1,63937,NS,"MT G7, AV Daka G5, Zombie G7, Spirit G6",0
"Rogue66697",1,0,93489,ShaakClones,"Shaak Ti G8, zRex zEcho (501st), zzFives ARC Trooper G7",0
"Rogue66697",1,1,71619,zEP,"EP G6, zzzVader Tarkin G6, TFP G6, Mara Jade, The Emperor's Hand 3* G7",0
"Rogue66697",1,0,51556,Wiggs,"Wedge G3, Biggs G5, Han G6, C-3PO G7, Leia G8",0
"Rogue66697",1,0,55686,Jawas,"Nebit G6, Jawa Engineer G5, Jawa Scavenger G5, Jawa G6, Dathcha G5",0
"Merth",0,1,97832,Geonosians,"zzGBA Sun Fac, Geo Soldier, Geo Spy, Poggle",1
"Merth",1,1,94739,Ewoks,"zChirpa Elder zPaploo zWicket zLogray",1
"Merth",0,1,88330,Phoenix,"Hera zZeb Ezra zKanan Chopper",1
"Merth",,,72920,Phasma,"Phasma G8, FOTP G9, FOE KRU Kylo G9",0
"Merth",0,1,55337,padme,"Padme G7, GK G6, JKA G9, Ahsoka G9, Fives G5",0
"Merth",1,1,66718,JTR,"JTR G7, Scav Rey G9, BB-8 G6, R2-D2 G9, Finn G9",0
"Merth",1,1,73942,Carth,"zCarth Onasi, Mission G9, Zaalbar 6* G8, Juhani 6* Canderous",0
"Merth",1,1,67987,zEP,"EP G9, Vader Tarkin G9, Dooku 5* G8, BSF 6*",0
"Merth",0,1,91839,BH,"Bossk 3* G7, Jango zzThe Mandalorian, Boba zIG-88",0
"Dannyk43",1,0,57960,Wiggs,"Wedge G8, Biggs G8, CLS G8, Ezra G8, Leia",1
"Dannyk43",1,1,92320,zEP,"zzEP G8, zzzVader Tarkin Dooku DN G8",1
"Dannyk43",,,49093,Phasma,"Phasma G8, FOE 5* FOO 6* G8, KRU 5* G8, Kylo G9",0
"Dannyk43",1,1,68543,NS_Alt,"MT G8, AV G8, Talia Spirit 6* G8, zDaka",0
"Dannyk43",0,1,71748,BH,"Bossk G7, Cad G9, Greedo zThe Mandalorian G8, Boba G9",0
"Dannyk43",1,0,62028,501st,"Rex G8, Clone Sergeant G8, Echo (501st) G8, Fives zAhsoka",0
"Dannyk43",1,0,50941,Troopers,"Veers Starck G6, Snowtrooper G8, DT 5* G8, Stormtrooper G9",0
"Dannyk43",0,1,47806,Phoenix,"Hera G8, Zeb G8, Sabine 5* G8, Kanan G8, Chopper G8",0
"Dannyk43",1,1,48323,Rogue1,"Jyn 6* G8, Chirrut 6* G8, Baze 6* G8, K-2SO G8, Cassian G8",0
"Dannyk43",0,1,49372,BH,"Jango G7, Dengar G7, Greef Karga G7, Zam G7, IG-88 G8",0
"The Dandalorian",0,1,139171,padme,"zzPadme zGK zJKA zAhsoka zzC-3PO",1
"The Dandalorian",0,1,97314,Geonosians,"zzGBA Sun Fac, Geo Soldier, Geo Spy, Poggle",1
"The Dandalorian",0,1,104086,Grievous,"zGG zB2 zB1 zDroideka MagnaGuard",1
"The Dandalorian",1,1,140180,GAS,"zzzzGAS zRex zEcho (501st), zzFives zARC Trooper",1
"The Dandalorian",1,1,133419,Revan Offense,"zzzJKR zGMY zBS zJolee zHYoda",1
"The Dandalorian",1,1,85011,Ewoks,"zChirpa Elder Paploo Wicket zLogray G9",1
"The Dandalorian",1,0,67190,Wiggs,"Wedge G9, Biggs G8, CLS G8, Ezra Leia G7",1
"The Dandalorian",,,433652,Negotiator,"Negotiator 6* HT 4* Anakin's Eta-2 Starfighter, Umbaran Starfighter, Ahsoka Tano's Jedi Starfighter, Clone Sergeant's ARC-170, Plo Koon's Jedi Starfighter, Rex's ARC-170",0
"The Dandalorian",,,84130,Nute-OR,"Nute zDooku Jango 6* G9, Zaalbar G8, zMission",0
"The Dandalorian",0,1,72228,BH,"Bossk 4* G9, Dengar G8, Greedo G9, Boba G9, IG-88",0
"The Dandalorian",1,1,79961,zEP,"EP G9, zzzVader Tarkin G7, TFP G9, zTraya G9",0
"The Dandalorian",1,0,48953,Troopers,"Veers 5* G7, Starck G7, Snowtrooper G7, Magma G7, zAdmiral Piett 3* G7",0
"The Dandalorian",0,1,60044,Phoenix,"Hera G8, Zeb G8, Sabine 4* G8, Kanan G8, Chopper G9",0
"Explxsive",0,1,83299,Geonosians,"zGBA Sun Fac, Geo Soldier, Geo Spy, Poggle",1
"Explxsive",1,1,123631,Revan,"zzzJKR zBS zGMY zJolee zGK",1
"Explxsive",1,1,110811,zEP,"zzEP zzVader Tarkin Krennic BSF",1
"Explxsive",0,1,70708,FO,"zKRU Kylo G8, FOO G8, Phasma G8, FOE",1
"Explxsive",0,1,69370,Phoenix,"Hera G8, Zeb G8, Ezra Kanan G8, Chopper G8",1
"Explxsive",1,1,70102,JTR,"JTR G8, Scav Rey, BB-8 G8, R2-D2 G8, Finn",0
"Explxsive",1,0,85643,Traya,"Traya 6* G8, DN 6* G9, Sion 6* Dooku Thrawn",0
"Explxsive",1,0,66307,Troopers,"Veers zAdmiral Piett, Moff Gideon 4* G9, Dark Trooper 4* G9, Range Trooper 4* G6",0
"Explxsive",1,1,46651,NS_Alt,"MT 5* G8, AV G8, Talia G8, Spirit 6* G8, Daka G9",0
"Explxsive",1,0,65361,501st,"Rex G8, Clone Sergeant G8, Echo (501st) G8, Fives G8, zAhsoka",0
"Explxsive",1,0,61178,Wiggs,"Wedge 5* G8, Biggs G8, CLS Han G9, Leia G9",0
"Explxsive",1,1,47876,Rogue1,"Jyn 5* G8, Chirrut G8, Baze 5* G8, K-2SO Cassian G8",0
"Whitefox",,,122602,Phasma,"zPhasma zFOTP FOSFTP zFOST zKylo",1
"Whitefox",0,1,91056,Geonosians,"zzGBA Sun Fac, Geo Soldier, Geo Spy, Poggle",1
"Whitefox",0,1,123454,BH,"zzBossk Dengar Cad Boba IG-88",1
"Whitefox",1,0,66979,Wiggs,"Wedge G8, Biggs G8, Chewbacca G9, zEzra Leia G9",1
"Whitefox",1,1,136701,SL Kylo,"zzzzzzSL Kylo, zSith Trooper, zHux zzKRU Thrawn G7",0
"Whitefox",,,226035,HansMF,"Home One 6*, Han's MF 6*, Rebel Y-wing 5*, Bistan's U-wing 3*, Phantom Ghost Cassian's U-wing 5*, Biggs X-wing",0
"Whitefox",1,1,42191,NS,"MT 6* G8, AV G8, Daka G8, Zombie 5* G8, Spirit 6* G8",0
"Whitefox",1,0,53784,ShaakClones,"Shaak Ti 4* G7, Rex G8, Echo (501st) G8, Fives G8, Clone Sergeant G8",0
"Whitefox",1,1,112413,zEP,"EP zzVader Tarkin G8, TFP BSF",0
"Whitefox",1,0,57270,Troopers,"Veers 5* G8, Starck G2, Snowtrooper G8, zAdmiral Piett, Stormtrooper G8",0
"Whitefox",0,1,62762,Phoenix,"Hera G9, Zeb G8, Sabine 5* G8, Kanan G8, Chopper G9",0
"Whitefox",0,1,62903,BH,"Jango 5* G8, Greedo G8, Embo G8, The Mandalorian G8, Greef Karga G9",0
"Whitefox",1,1,43481,Rogue1,"Jyn 5* G8, Chirrut 5* G8, Baze 6* G8, K-2SO G8, Cassian G8",0
"Whitefox",0,1,64431,BS,"BS 6* G8, GMY JKA G9, GK G6, Ahsoka G8",0
"Bespoke Knave",0,1,79904,Geonosians,"zGBA Sun Fac G7, Geo Soldier G7, Geo Spy, Poggle",1
"Bespoke Knave",1,1,105959,Revan Offense,"zzzJKR zGMY BS zJolee zEzra",1
"Bespoke Knave",1,1,87129,Carth,"zCarth Onasi, zMission Zaalbar Juhani G8, Canderous",1
"Bespoke Knave",0,1,84695,FO,"zzKRU Kylo FOO G8, Phasma G8, FOE G9",1
"Bespoke Knave",1,0,70174,Wiggs,"Wedge G7, Biggs G8, CLS zHan G9, Leia G8",1
"Bespoke Knave",0,1,88651,DR,"zzDR HK-47 BSF Sith Empire Trooper G7, Thrawn G9",0
"Bespoke Knave",1,1,71849,JTR,"JTR G8, Scav Rey G9, BB-8 G8, R2-D2 G8, Finn G9",0
"Bespoke Knave",1,1,53598,Ewoks,"Chirpa G7, Elder G6, Paploo G7, Wicket G6, Logray G7",0
"Bespoke Knave",0,1,95865,BH,"Bossk Jango Dengar Cad Boba",0
"Lightning Warrior",0,1,91631,Geonosians,"zzGBA Sun Fac, Geo Soldier, Geo Spy, Poggle",1
"Lightning Warrior",1,1,132663,Revan,"zzzJKR zBS zzGMY zJolee zGK",1
"Lightning Warrior",,,41929,Phasma,"Phasma G6, FOTP 6* G8, FOO G6, KRU 6* G8, Kylo G7",0
"Lightning Warrior",1,1,82009,Carth,"zCarth Onasi, Mission G7, Zaalbar G9, zJuhani Canderous",0
"Lightning Warrior",1,1,50160,Ewoks,"Chirpa 4* G5, Elder G6, Paploo 5* G6, Teebo G6, Wicket 4* G7",0
"Lightning Warrior",1,0,62053,Wiggs,"Wedge 6* G6, Biggs G8, CLS Ezra G9, Leia G9",0
"Lightning Warrior",0,1,76780,BH,"Jango 5* G9, Cad G9, The Mandalorian, Greef Karga G9, Boba G9",0
"Lightning Warrior",0,1,63876,Phoenix,"Hera G7, Zeb G7, Sabine G9, Kanan G8, Chopper G9",0
"OrangeFox",0,1,132299,padme,"zzPadme zGK zJKA zAhsoka zC-3PO",1
"OrangeFox",0,1,92036,Geonosians,"zzGBA Sun Fac, Geo Soldier, Geo Spy, Poggle",1
"OrangeFox",1,1,79449,Ewoks,"zChirpa Elder Paploo G9, Wicket zLogray G9",1
"OrangeFox",0,1,65658,Phoenix,"Hera Zeb G8, Ezra G9, Kanan G8, Chopper G8",1
"OrangeFox",,,51161,Phasma,"Phasma G8, FOE 5* G8, FOO G8, KRU 5* G9, Kylo 6* G8",0
"OrangeFox",0,1,87589,Grievous,"GG 6* G8, zB2 zB1 MagnaGuard Nute",0
"OrangeFox",1,1,59220,NS_Alt,"MT G8, zAV Talia 6* Spirit 6* G8, Daka G8",0
"OrangeFox",1,0,95408,ShaakClones,"zShaak Ti, zRex zEcho (501st), Fives Clone Sergeant",0
"OrangeFox",1,1,76507,zEP,"EP G9, zzzVader Tarkin DT 6* G8, Mara Jade, The Emperor's Hand 2*",0
"OrangeFox",0,1,69320,BH,"Bossk 2* G9, Jango G8, Cad Boba IG-88 G8",0
"OrangeFox",1,0,44790,Troopers,"Veers 6* G8, Starck G6, Snowtrooper G8, Shoretrooper 6* G8, Stormtrooper G8",0
"OrangeFox",1,0,48633,Wiggs,"Wedge 5* G8, Biggs G8, Han G7, Fulcrum 5* G7, Leia G8",0
"OrangeFox",1,1,37835,Rogue1,"Jyn 5* G8, Chirrut 5* G8, Baze 5* G8, K-2SO G8, Cassian 5* G8",0
"OrangeFox",,,45227,Bad Batch,"Hunter 3* G9, Echo 4* G9, Omega 4* G8, Tech 2* Wrecker 5* G8",0
"Shadowmoth360",0,1,88215,Geonosians,"zzGBA Sun Fac, Geo Soldier, Geo Spy, Poggle",1
"Shadowmoth360",0,1,93837,BH,"zBossk Cad G9, zThe Mandalorian, Greef Karga G8, zBoba",1
"Shadowmoth360",0,1,133925,FO,"zzKRU zKylo zHux zFOST FOE",1
"Shadowmoth360",0,1,63516,Phoenix,"Hera Zeb G8, Ezra G8, Kanan G8, Chopper",1
"Shadowmoth360",1,1,33161,NS_Alt,"MT 5* G8, AV 5* G8, Talia 5* G8, Spirit 5* G8, Daka 5* G8",0
"Shadowmoth360",1,1,85014,zEP,"EP Vader Tarkin G8, TFP zSith Trooper",0
"Shadowmoth360",1,0,33161,501st,"Rex 5* G8, Clone Sergeant 5* G8, Echo (501st) 5* G8, Fives 5* G8, Ahsoka 5* G8",0
"Shadowmoth360",1,0,33161,Wiggs,"Wedge 5* G8, Biggs 5* G8, Leia 5* G8, Chirrut 5* G8, Baze 5* G8",0
