Player,Offense,Defense,GP,Name,Squad,Viable
"Invictus Ronin",1,1,95150,Ewoks,"zChirpa Elder zPaploo zWicket zLogray",1
"Invictus Ronin",1,0,161150,501st,"zRex zARC Trooper, zEcho (501st), zzFives zAhsoka",1
"Invictus Ronin",,,512191,Negotiator,"Negotiator 5* BTL-B Y-wing Starfighter, Anakin's Eta-2 Starfighter 5*, Rex's ARC-170, Umbaran Starfighter, Ahsoka Tano's Jedi Starfighter, Plo Koon's Jedi Starfighter, Clone Sergeant's ARC-170",0
"Invictus Ronin",0,1,48177,Geonosians,"GBA 4* G9, Sun Fac G5, Geo Soldier G8, Geo Spy 6* G8, Poggle G5",0
"Invictus Ronin",0,1,74790,Grievous,"zzGG 5* zB2 5* zB1 5* zDroideka 3* zDooku 6*",0
"Ramrapster",0,1,89092,Geonosians,"zzGBA Sun Fac G9, Geo Soldier, Geo Spy, Poggle",1
"Ramrapster",0,1,101610,BH,"zBossk Jango Cad Boba IG-88 G9",1
"Ramrapster",1,1,110322,zEP,"zzEP zzzVader Tarkin G8, TFP G8, zBSF",1
"Ramrapster",1,0,96391,CLS,"zzCLS Han Leia G9, Old Ben G9, zChewbacca",1
"Ramrapster",0,1,58973,Phoenix,"Hera G8, Zeb G8, Ezra G8, Kanan G8, Chopper G8",1
"Ramrapster",,,78612,Phasma,"Phasma G9, FOE 5* FOSFTP G9, zKRU Kylo 6* G9",0
"Ramrapster",,,256879,HansMF,"Home One, Han's MF 5*, Rebel Y-wing 4*, Ghost Phantom Biggs X-wing, Cassian's U-wing 5*, Wedge X-wing",0
"Ramrapster",0,1,43231,Grievous,"GG 5* G8, B2 5* G7, MagnaGuard 6* G8, Dooku 6* G9, T3-M4 G7",0
"Ramrapster",1,1,36782,NS_Alt,"MT 5* G8, AV G8, Talia 5* G8, Spirit 5* G8, Daka 5* G8",0
"Ramrapster",1,0,66073,ShaakClones,"Shaak Ti 5* G9, Rex Echo (501st), Fives G9, Clone Sergeant G8",0
"Ramrapster",1,0,59435,Troopers,"Veers 6* Starck G9, Shoretrooper 6* G8, DT G9, Stormtrooper G8",0
"Ramrapster",0,1,68594,BS,"BS GMY G9, Jolee GK 6* G7, Ahsoka G8",0
"Ramrapster",1,1,35051,Rogue1,"Jyn 5* G8, Chirrut 5* G8, Baze 5* G8, K-2SO 5* G8, Cassian 5* G8",0
"Ramrapster",1,0,6145,NestSolo (Counter),"Nest 4* G7",0
"ClericalFarm",,,160576,SEE,"zzzzzzSEE zBSF zzMalak zzzDR zzzVader",1
"ClericalFarm",0,1,123065,padme,"zzPadme zGK zJKA zAhsoka zBarriss",1
"ClericalFarm",,,362216,HansMF,"Home One, Han's MF, HT Bistan's U-wing, Phantom Ghost Cassian's U-wing, Wedge X-wing",1
"ClericalFarm",1,1,114368,NS_Alt,"zzMT Acolyte zDaka zzAV Zombie",1
"ClericalFarm",0,1,97991,Geonosians,"zzGBA Sun Fac, Geo Soldier, Geo Spy, Poggle",1
"ClericalFarm",1,1,108116,JTR,"zzzJTR Scav Rey, zzBB-8 zR2-D2 zFinn",1
"ClericalFarm",1,0,109940,CLS,"zzCLS zHan zzChewbacca Thrawn zC-3PO",1
"ClericalFarm",1,1,115603,Revan Offense,"zzzJKR zGMY G9, zBS zJolee Ezra",1
"ClericalFarm",1,1,95600,Ewoks,"zChirpa Elder zPaploo zWicket zLogray",1
"ClericalFarm",1,0,106572,ShaakClones,"zzShaak Ti, zRex zEcho (501st), zzFives zARC Trooper",1
"ClericalFarm",0,1,132850,BH,"zzBossk zzJango zDengar zEmbo zBoba",1
"ClericalFarm",1,0,115898,Troopers,"zVeers zStarck Snowtrooper Range Trooper, zzAdmiral Piett",1
"ClericalFarm",0,1,81837,FO,"zKRU Kylo FOST G9, FOO G8, zPhasma",1
"ClericalFarm",0,1,97656,Grievous,"GG G1, zB2 zB1 zDroideka MagnaGuard",0
"ClericalFarm",,,356234,Executrix,"Executrix Tie Adv, Emperor's Shuttle 4*, TIE Reaper 5*, Imperial TIE Fighter, Gauntlet Starfighter 6*, First Order SF TIE Fighter, First Order TIE Fighter",0
"ClericalFarm",1,1,85916,Carth,"Carth Onasi, Mission zZaalbar Juhani G7, zCanderous",0
"ClericalFarm",1,0,116504,zMaul,"Darth Maul, zSidious zDooku Sith Marauder, Nest 6* G8",0
"ClericalFarm",0,1,72712,Phoenix,"Hera Zeb G9, zSabine 6* G7, Kanan G8, Chopper",0
"Sapphirefox",0,1,121060,padme,"zzPadme zGK zJKA zAhsoka zC-3PO",1
"Sapphirefox",0,1,89480,Geonosians,"zzGBA Sun Fac, Geo Soldier, Geo Spy, Poggle",1
"Sapphirefox",1,1,80670,Ewoks,"zChirpa Elder Paploo Wicket zLogray",1
"Sapphirefox",0,1,76021,Phoenix,"Hera Zeb G8, Ezra Kanan Chopper G9",1
"Sapphirefox",,,59291,Phasma,"Phasma G8, FOE 5* G9, FOO G8, KRU Kylo 6* G8",0
"Sapphirefox",1,0,67994,CLS,"zCLS Han G8, Chewbacca 5* G8, R2-D2 G8, Stormtrooper Han G9",0
"Sapphirefox",,,224713,HansMF,"Home One, Han's MF 5*, HT 5* Ghost Phantom 6* Biggs X-wing, Cassian's U-wing, Wedge X-wing",0
"Sapphirefox",0,1,83000,Grievous,"GG 5* G9, B2 B1 Droideka MagnaGuard",0
"Sapphirefox",1,0,89678,Troopers,"zVeers zzAdmiral Piett, Moff Gideon, Dark Trooper, Range Trooper",0
"Sapphirefox",1,1,67682,NS_Alt,"MT G8, zzAV Talia 6* G8, Spirit G8, Daka G9",0
"Sapphirefox",1,0,91626,ShaakClones,"zShaak Ti, Rex Echo (501st) G8, Fives Clone Sergeant",0
"Sapphirefox",1,1,84574,zEP,"zEP zzzVader Tarkin DT G8, TFP G9",0
"Sapphirefox",0,1,77284,BH,"Bossk 4* G7, Jango Cad Boba IG-88 G9",0
"Sapphirefox",1,1,45431,Rogue1,"Jyn 5* G8, Chirrut 5* G8, Baze 6* G8, K-2SO G8, Cassian 5* G8",0
"Mol Kibar",,,133191,Phasma,"zPhasma FOE FOO zzKRU zKylo",1
"Mol Kibar",0,1,85879,Geonosians,"zGBA Sun Fac G9, Geo Soldier, Geo Spy, Poggle",1
"Mol Kibar",,,307024,HansMF,"Home One, Han's MF 5*, HT 6* Ghost Phantom Biggs X-wing, Cassian's U-wing, Wedge X-wing",1
"Mol Kibar",1,0,108349,CLS,"zzzCLS zHan zzChewbacca R2-D2 G8, C-3PO G9",1
"Mol Kibar",1,1,82834,Ewoks,"zChirpa Elder Paploo Teebo Wicket",1
"Mol Kibar",1,1,107353,zEP,"zzEP zzzVader Tarkin Dooku TFP G8",1
"Mol Kibar",0,1,67815,Phoenix,"Hera Zeb G8, Ezra G9, Kanan G8, Chopper",1
"Mol Kibar",1,1,54883,NS,"MT G8, AV Daka G9, Zombie 5* G8, Spirit G8",0
"Mol Kibar",1,1,67420,Revan,"JKR G7, BS GMY Jolee G8, GK G7",0
"Mol Kibar",0,1,90313,BH,"Bossk Jango Dengar Boba Zam",0
"Mol Kibar",1,0,56541,501st,"Rex G8, Clone Sergeant G8, Echo (501st) G8, Fives G8, Ahsoka",0
"Mol Kibar",1,1,47040,Rogue1,"Jyn 6* G8, Chirrut 6* G8, Baze G8, K-2SO G8, Cassian G8",0
"Lycanthia",0,1,92433,Geonosians,"zzGBA Sun Fac, Geo Soldier, Geo Spy, Poggle",1
"Lycanthia",1,1,105674,Revan Offense,"zzzJKR GMY zBS zJolee JKA",1
"Lycanthia",1,1,83477,Carth,"Carth Onasi, zMission zZaalbar Juhani G8, Canderous",1
"Lycanthia",0,1,69180,Phoenix,"zHera G9, Zeb G9, Ezra Kanan Chopper",1
"Lycanthia",,,48451,Phasma,"Phasma G8, FOE 5* G8, FOO G8, KRU Kylo 6* G8",0
"Lycanthia",1,1,39395,NS_Alt,"MT 6* G8, AV G8, Talia 5* G8, Spirit 5* G8, Daka 5* G8",0
"Lycanthia",1,1,81311,zEP,"EP G8, zVader G8, Tarkin Dooku 6* G8, zBSF",0
"Lycanthia",1,0,40232,501st,"Rex 5* G8, Clone Sergeant 5* G8, Echo (501st) 5* G8, Fives 5* G8, Ahsoka",0
"Lycanthia",1,0,58035,Troopers,"Veers Starck G7, Range Trooper G7, Moff Gideon G8, Stormtrooper G8",0
"Lycanthia",1,1,45777,Rogue1,"Jyn G8, Chirrut 5* G8, Baze 5* G8, K-2SO G8, Cassian G8",0
"Fnodo",0,1,92433,Geonosians,"zzGBA Sun Fac, Geo Soldier, Geo Spy, Poggle",1
"Fnodo",,,80959,Iden Troopers,"zIden Versio 5*, Shoretrooper Snowtrooper Magma DT",1
"Fnodo",0,1,69491,Phoenix,"Hera Zeb G8, Ezra Kanan G8, Chopper G9",1
"Fnodo",,,120587,Bad Batch,"zHunter zEcho zzOmega zTech zWrecker",1
"Fnodo",,,36818,Phasma,"Phasma 6* G8, FOE 5* FOO 5* G8, KRU 5* G8, Kylo 5* G8",0
"Fnodo",1,1,34301,NS_Alt,"MT 5* G8, AV 6* G8, Talia 5* G8, Spirit 5* G8, Daka 5* G8",0
"Fnodo",1,1,60603,zEP,"EP G9, Vader Tarkin Dooku 5* G8, DN 5* G8",0
"Fnodo",1,0,58223,501st,"Rex G8, Clone Sergeant 5* G8, Echo (501st) G8, Fives Ahsoka",0
"Fnodo",1,0,57296,Wiggs,"Wedge 5* G8, Biggs 5* G8, zzCLS Han 5* G7, Leia G8",0
"Fnodo",1,1,41123,Rogue1,"Jyn 5* G8, Chirrut 5* G8, Baze 6* G8, K-2SO G8, Cassian G8",0
"Fnodo",0,1,55805,BS,"BS 5* G8, GMY Old Ben G9, GK 5* G7, JKA 5* G9",0
"Exar Kun",0,1,132154,DRMalak,"zzzDR zzHK-47 zBSF zzMalak Sith Empire Trooper G9",1
"Exar Kun",0,1,93901,Geonosians,"zzGBA Sun Fac, Geo Soldier, Geo Spy, Poggle",1
"Exar Kun",1,1,99375,Carth,"zCarth Onasi, zMission zZaalbar zJuhani zCanderous",1
"Exar Kun",0,1,101378,BH,"zBossk Jango Cad zThe Mandalorian, zBoba",1
"Exar Kun",0,1,78034,Phoenix,"Hera Zeb Ezra Kanan Chopper G9",1
"Exar Kun",0,1,85285,padme,"zzPadme GK G9, JKA Ahsoka Fives G8",1
"Exar Kun",1,1,69489,NS_Alt,"MT G9, AV G9, Talia G8, Daka G9, Zombie G7",0
"Exar Kun",1,1,83090,zEP,"EP zzVader Tarkin G9, Sion 5* G7, DN",0
"EnderDragon10505",1,1,129514,NestSisters,"zzAV zzMT zDaka Zombie zNest",1
"EnderDragon10505",0,1,90447,Geonosians,"zGBA Sun Fac, Geo Soldier, Geo Spy, Poggle",1
"EnderDragon10505",1,0,82471,Wiggs,"Wedge Biggs zzCLS Han G7, zLeia",1
"EnderDragon10505",,,58287,Phasma,"Phasma G8, FOTP FOSFTP G7, FOST 6* G8, Kylo G8",0
"EnderDragon10505",0,1,60847,padme,"Padme G8, GK G7, JKA 5* G8, Ahsoka G8, zBarriss",0
"EnderDragon10505",0,1,81843,Grievous,"zzGG zB2 B1 5* MagnaGuard G8, IG-88 G8",0
"EnderDragon10505",1,0,71248,Traya,"zTraya 5* G9, zDN 5* G9, Sion 4* G9, zEP Sith Empire Trooper 6* G8",0
"EnderDragon10505",1,1,51920,Ewoks,"zChirpa 4* G9, Elder 6* G8, Paploo 6* G9, Scout 6* G8, zWicket 4* G7",0
"EnderDragon10505",0,1,99353,BH,"zBossk 4* zFennec Shand, Cad zThe Mandalorian, Boba",0
"EnderDragon10505",1,0,33161,Clones,"Cody 5* G8, Rex 5* G8, Echo (501st) 5* G8, Fives 5* G8, Clone Sergeant 5* G8",0
"EnderDragon10505",0,1,44099,Phoenix,"Hera 6* G8, Zeb G8, Sabine 5* G8, Kanan G8, Chopper 6* G8",0
"EnderDragon10505",1,1,33713,Rogue1,"Jyn 5* G8, Chirrut 5* G8, Baze 5* G8, K-2SO 5* G8, Cassian 5* G8",0
"EnderDragon10505",0,1,54688,BS,"BS 5* G8, GMY zJolee 3* G8, Old Ben G9, Ezra 5* G8",0
"Jizmak667",0,1,64770,Geonosians,"GBA Sun Fac G8, Geo Soldier G8, Geo Spy G8, Poggle G8",1
"Jizmak667",0,1,72583,Phoenix,"Hera G9, Zeb G9, Ezra G9, Kanan G9, Chopper G9",1
"Jizmak667",,,91111,Bad Batch,"zHunter Echo zzOmega zTech Wrecker",1
"Jizmak667",1,0,21052,SionSolo (Counter),"zSion",1
"Jizmak667",,,67489,Phasma,"Phasma G8, FOTP G9, FOSFTP G7, KRU Kylo G8",0
"Jizmak667",1,1,101793,zEP,"EP zzzVader Tarkin TFP G8, zzDN",0
"SgtPickle",0,1,126389,DRMalak,"zzzDR zzHK-47 zBSF zzMalak Sith Empire Trooper",1
"SgtPickle",,,308833,HansMF,"Home One, Han's MF 5*, Biggs X-wing, Bistan's U-wing, Phantom Ghost Cassian's U-wing, Wedge X-wing",1
"SgtPickle",0,1,87118,Geonosians,"zGBA Sun Fac, Geo Soldier, Geo Spy, Poggle",1
"SgtPickle",1,1,98887,JTR,"zzJTR Scav Rey, zBB-8 zzR2-D2 Finn",1
"SgtPickle",1,1,108142,Revan,"zzzJKR BS zGMY zJolee GK",1
"SgtPickle",1,0,113373,CLS,"zzzCLS zHan zChewbacca zThrawn zC-3PO",1
"SgtPickle",1,1,80426,Ewoks,"zChirpa Elder Paploo G9, Wicket Logray",1
"SgtPickle",1,1,93118,Carth,"zCarth Onasi, zMission zZaalbar Juhani Canderous",1
"SgtPickle",1,1,99189,zEP,"zzEP zzVader Tarkin G9, TFP zSion",1
"SgtPickle",0,1,74217,Phoenix,"Hera G9, Zeb G9, Ezra Kanan G8, Chopper G9",1
"SgtPickle",,,60901,Phasma,"Phasma G8, FOTP G8, FOO G8, KRU G9, Kylo G8",0
"SgtPickle",1,0,66300,ShaakClones,"Shaak Ti 5* G8, Rex Echo (501st) G7, zFives ARC Trooper G8",0
"SgtPickle",0,1,97174,BH,"zBossk 6* Dengar Cad Greedo zBoba",0
"Lezene Icewalker",0,1,131420,padme,"zzPadme zGK zJKA zAhsoka zzC-3PO",1
"Lezene Icewalker",1,0,133616,CLS,"zzzCLS zHan zzChewbacca zzR2-D2 zOld Ben",1
"Lezene Icewalker",1,1,91685,NS_Alt,"zzMT zAV Talia Daka Zombie",1
"Lezene Icewalker",0,1,111195,DR,"zzzDR zHK-47 zBSF Sith Marauder, zThrawn",1
"Lezene Icewalker",0,1,95155,Geonosians,"zzGBA Sun Fac, Geo Soldier, Geo Spy, Poggle",1
"Lezene Icewalker",,,412982,HansMF,"Home One, Han's MF, HT Ghost Phantom Biggs X-wing, Cassian's U-wing, Wedge X-wing",1
"Lezene Icewalker",0,1,86352,Grievous,"zzGG zB2 B1 Droideka G8, MagnaGuard G9",1
"Lezene Icewalker",1,1,147130,Revan Offense,"zzzJKR zGMY zBS zJolee zHYoda",1
"Lezene Icewalker",1,1,92285,Ewoks,"zChirpa Elder zPaploo Teebo zWicket",1
"Lezene Icewalker",1,1,82540,Carth,"Carth Onasi, Mission G8, Zaalbar Juhani Canderous",1
"Lezene Icewalker",0,1,108646,BH,"zzBossk zJango zGreedo Boba zZam",1
"Lezene Icewalker",1,1,114753,zEP,"zzEP zzzVader zTarkin TFP zSion",1
"Lezene Icewalker",0,1,99375,FO,"zzKRU zKylo FOO zFOTP FOE",1
"Lezene Icewalker",0,1,88712,Phoenix,"zHera zZeb G9, zEzra zKanan G9, Chopper",1
"Lezene Icewalker",1,0,15843,NestSolo (Counter),"Nest",1
"Lezene Icewalker",,,81332,Mon Mothma,"Mon Mothma 6* G8, Biggs Wedge Lando Pao",0
"Lezene Icewalker",1,0,91548,ShaakClones,"zzShaak Ti, Rex G8, Echo (501st) G9, zzFives ARC Trooper G8",0
"Lezene Icewalker",1,1,64384,Rogue1,"Jyn G8, Chirrut G8, Baze 6* G8, K-2SO G8, Cassian G8",0
"The Massalorian",0,1,75860,Geonosians,"GBA G9, Sun Fac G7, Geo Soldier, Geo Spy, Poggle",1
"The Massalorian",0,1,98828,BH,"zBossk zJango Dengar Cad Boba",1
"The Massalorian",0,1,81202,Phoenix,"Hera Zeb Ezra Kanan Chopper",1
"The Massalorian",0,1,105733,BS,"zBS zzGMY Jolee GK JKA",1
"The Massalorian",,,71000,Phasma,"Phasma G8, FOE G9, Sith Trooper, KRU G8, Kylo G9",0
"The Massalorian",1,0,81529,CLS,"zCLS Han G9, Chewbacca G7, R2-D2 Old Ben",0
"The Massalorian",1,1,99552,zEP,"zzEP zzzVader zTarkin TFP 5* G9, Traya 6* G7",0
"The Massalorian",1,0,48275,Troopers,"Veers 6* G7, Starck Snowtrooper G5, Magma G5, Dark Trooper 6* G9",0
"Hank",,,95574,Phasma,"zPhasma FOE FOO zzKRU Kylo",1
"Hank",0,1,92796,Geonosians,"zzGBA Sun Fac, Geo Soldier, Geo Spy, Poggle",1
"Hank",1,1,108346,Revan Offense,"zzzJKR zGMY zBS zJolee Ezra G9",1
"Hank",1,1,94293,Ewoks,"zChirpa Elder Paploo zWicket zLogray",1
"Hank",0,1,90871,BH,"zzBossk Jango Dengar G9, The Mandalorian, Boba",1
"Hank",1,0,72149,Wiggs,"Wedge G8, Biggs G8, zzCLS Han Chewbacca G9",1
"Hank",0,1,65243,padme,"Padme G9, zGK G7, JKA G9, Ahsoka CW Chewbacca G8",0
"Hank",,,241355,HansMF,"Home One, Han's MF 5*, Rebel Y-wing 4*, Bistan's U-wing 5*, Phantom Ghost Cassian's U-wing 6*, Biggs X-wing",0
"Hank",0,1,76038,DR,"zDR HK-47 BSF Sith Marauder G1, Thrawn G8",0
"Hank",0,1,62535,Grievous,"GG G8, B2 G1, Dooku IG-88 T3-M4 G7",0
"Hank",1,1,53226,NS,"MT 6* G8, AV G9, Daka G9, Zombie G8, Spirit G8",0
"Hank",1,1,68643,Carth,"Carth Onasi G9, Mission Zaalbar G9, Juhani G8, Canderous G7",0
"Hank",1,0,55601,ShaakClones,"Shaak Ti G7, Rex G8, Echo (501st) G8, Fives G8, Clone Sergeant G8",0
"Hank",1,1,75488,zEP,"EP zzzVader Tarkin G8, TFP G8, DN 5* G8",0
"Hank",,,43856,Iden Troopers,"Iden Versio 3* G8, Stormtrooper G8, Snowtrooper G8, Magma G5, DT 5* G8",0
"Hank",0,1,63115,Phoenix,"Hera Zeb Sabine 5* G8, Kanan Chopper",0
"Hank",1,1,46617,Rogue1,"Jyn 5* G8, Chirrut G8, Baze 6* G8, K-2SO G8, Cassian G8",0
"Didit4daWookie",,,162383,SEE,"zzzzzzSEE zBSF zzMalak zzzDR zzzVader",1
"Didit4daWookie",1,1,96378,NS,"zzMT zzAV Daka Zombie Spirit",1
"Didit4daWookie",0,1,142139,padme,"zzPadme zGK zJKA zAhsoka zzC-3PO",1
"Didit4daWookie",1,0,132744,CLS,"zzzCLS zHan zzChewbacca zzR2-D2 zzOld Ben",1
"Didit4daWookie",,,296982,Malevolence,"Malevolence Hyena Bomber, Vulture Droid, Sun Fac SF, Soldier SF, Spy SF",1
"Didit4daWookie",,,369737,HansMF,"Home One, Han's MF, Rebel Y-wing 6*, Bistan's U-wing, Phantom Ghost Cassian's U-wing, Wedge X-wing",1
"Didit4daWookie",,,439931,Negotiator,"Negotiator HT Anakin's Eta-2 Starfighter, Umbaran Starfighter, Ahsoka Tano's Jedi Starfighter, Clone Sergeant's ARC-170, Jedi Consular's Starfighter, Plo Koon's Jedi Starfighter",1
"Didit4daWookie",0,1,92954,Geonosians,"zzGBA Sun Fac, Geo Soldier, Geo Spy, Poggle",1
"Didit4daWookie",0,1,115274,Grievous,"zzGG zB2 zB1 zMagnaGuard zNute",1
"Didit4daWookie",1,0,121092,Traya,"zzTraya zDN zSion zzEP zzThrawn",1
"Didit4daWookie",1,1,114738,GAS,"zzzzGAS zRex zEcho (501st), zzFives zARC Trooper",1
"Didit4daWookie",1,1,124696,Revan Offense,"zzzJKR zGMY zBS zJolee zzHYoda",1
"Didit4daWookie",1,1,86830,Ewoks,"zChirpa Elder Paploo zWicket Logray",1
"Didit4daWookie",0,1,104899,BH,"zzBossk zJango Dengar zzThe Mandalorian, zBoba",1
"Didit4daWookie",1,1,90707,Carth,"zCarth Onasi, zMission zZaalbar Juhani Canderous",1
"Didit4daWookie",0,1,84223,FO,"zzKRU zKylo FOO G8, FOTP FOE",1
"Didit4daWookie",0,1,73062,Phoenix,"Hera G9, Zeb G8, Sabine G8, zEzra Kanan G9",1
"Didit4daWookie",1,1,62764,Rogue1,"Jyn G8, Chirrut G8, Baze G8, K-2SO G8, Cassian G8",1
"Didit4daWookie",1,0,71487,Jawas,"Nebit G9, Jawa Engineer, Jawa Scavenger G9, Jawa Dathcha G9",1
"Didit4daWookie",,,95197,Mon Mothma,"zzMon Mothma, Biggs Wedge Lando zKyle Katarn",0
"Didit4daWookie",1,0,97499,Troopers,"zVeers zStarck Magma G7, zzAdmiral Piett, Stormtrooper G9",0
"Didit4daWookie",1,0,112439,zMaul,"Darth Maul, zSidious zDooku Sith Marauder, Nest 5* G6",0
"Nerdforce1",0,1,92208,padme,"zPadme zGK JKA zAhsoka CW Chewbacca G8",1
"Nerdforce1",0,1,104353,Geonosians,"zzGBA Sun Fac, Geo Soldier, Geo Spy, Poggle",1
"Nerdforce1",1,1,87540,JTR,"zzJTR Scav Rey, BB-8 R2-D2 G8, Finn",1
"Nerdforce1",1,1,91411,zEP,"zEP zzzVader Tarkin DT G8, TFP G9",1
"Nerdforce1",0,1,80704,FO,"zKRU Kylo G9, FOO Phasma G9, FOE",1
"Nerdforce1",1,0,66731,Wiggs,"Wedge G8, Biggs G8, Han Ezra G9, Leia",1
"Nerdforce1",1,1,84527,Rogue1,"zJyn Chirrut Baze K-2SO G9, Cassian",1
"Nerdforce1",0,1,55068,Grievous,"GG 5* G9, B2 4* G8, MagnaGuard G8, Dooku IG-88 G9",0
"Nerdforce1",1,1,45046,NS_Alt,"MT 6* G8, AV G9, Talia 5* G8, Spirit 5* G8, Daka G8",0
"Nerdforce1",1,0,70763,ShaakClones,"Shaak Ti 3* G8, Rex Echo (501st), zFives Clone Sergeant 5* G8",0
"Nerdforce1",1,1,44834,Ewoks,"Chirpa 5* G8, Elder 5* G8, Paploo 6* G6, Wicket 4* G6, Logray 5* G7",0
"Nerdforce1",0,1,69820,Phoenix,"zHera G9, Zeb Sabine 6* G8, Kanan G9, Chopper G8",0
"Sckurrr",0,1,87849,Geonosians,"zzGBA Sun Fac, Geo Soldier, Geo Spy, Poggle",1
"Sckurrr",1,1,92595,Revan Offense,"zzzJKR GMY BS zJolee Ezra G9",1
"Sckurrr",0,1,114235,FO,"zzKRU zKylo zHux FOST FOE G9",1
"Sckurrr",1,0,74909,Troopers,"zVeers zAdmiral Piett 4* G8, zMoff Gideon 6*, Dark Trooper, Range Trooper 5*",0
"Sckurrr",,,48518,Nute-OR,"Nute G5, Dooku 5* G8, Jango G9, Zaalbar G7, Mission G8",0
"Sckurrr",1,1,37815,NS_Alt,"MT 5* G8, AV 5* G8, Talia 5* G8, Spirit 5* G8, Daka G8",0
"Sckurrr",1,1,81040,zEP,"EP zzVader G9, Tarkin G8, zSith Trooper, DN 5* G8",0
"Sckurrr",0,1,62803,BH,"Bossk 6* Cad G9, Greedo G8, Boba G8, IG-88 5* G8",0
"Sckurrr",1,0,47021,501st,"Rex 5* G8, Clone Sergeant G8, Echo (501st) 5* G8, Fives G9, Ahsoka G9",0
"Sckurrr",0,1,55432,Phoenix,"Hera G9, Zeb G8, Sabine 5* G8, Kanan G8, Chopper G8",0
"Sckurrr",1,0,36296,Wiggs,"Wedge 5* G8, Biggs 5* G8, Leia G8, Chirrut 5* G8, Baze 5* G8",0
"The Time Ninja",0,1,108986,padme,"zzPadme GK zJKA zAhsoka C-3PO",1
"The Time Ninja",0,1,91755,Geonosians,"zzGBA Sun Fac, Geo Soldier, Geo Spy, Poggle",1
"The Time Ninja",,,356034,HansMF,"Home One, Han's MF 6*, HT 6* Ghost Phantom Biggs X-wing, Cassian's U-wing, Wedge X-wing",1
"The Time Ninja",1,1,109291,Revan Offense,"zzzJKR zGMY BS zJolee zEzra",1
"The Time Ninja",1,1,83396,Ewoks,"zChirpa Elder Paploo Wicket Logray",1
"The Time Ninja",0,1,107950,BH,"zBossk Dengar G8, zThe Mandalorian, Boba zZam",1
"The Time Ninja",1,0,101687,CLS,"zzzCLS zHan Wedge G8, Biggs zChewbacca",1
"The Time Ninja",1,1,87633,zEP,"zEP G9, zzzVader Tarkin G8, Dooku G8, TFP G8",1
"The Time Ninja",1,0,15939,NestSolo (Counter),"Nest",1
"The Time Ninja",,,74004,Phasma,"Phasma G8, Sith Trooper 4* G9, FOO G8, zKRU zKylo",0
"The Time Ninja",1,1,71312,JTR,"JTR G8, Scav Rey G8, BB-8 G8, zR2-D2 G8, Finn",0
"The Time Ninja",1,0,73089,Traya,"zTraya 5* DN 6* G9, Sion 6* G9, BSF 6* zThrawn G9",0
"The Time Ninja",0,1,66306,Grievous,"zzGG B2 6* G8, B1 6* G9, IG-88 G8, T3-M4 G8",0
"The Time Ninja",1,1,39691,NS_Alt,"MT 5* G8, AV G8, Talia 6* G8, Spirit 5* G8, Daka 6* G8",0
"The Time Ninja",1,0,69141,ShaakClones,"Shaak Ti G8, Rex Echo (501st) G8, Fives G8, Clone Sergeant G8",0
"The Time Ninja",1,1,62291,Carth,"Carth Onasi, Mission G8, Zaalbar G7, Juhani 6* G8, Canderous 6* G7",0
"The Time Ninja",1,0,49647,Troopers,"Veers 6* G9, Starck G6, Snowtrooper G8, Magma G7, Stormtrooper G8",0
"The Time Ninja",0,1,63181,Phoenix,"Hera G8, Zeb G8, Sabine 6* G8, Kanan G8, Chopper G9",0
"The Time Ninja",0,1,64501,BH,"Jango Aurra 4* G9, Cad G8, Embo 6* G8, Greef Karga 6* G8",0
"The Time Ninja",1,1,46988,Rogue1,"Jyn 5* G8, Chirrut 6* G8, Baze 5* G8, K-2SO 5* G8, Cassian G9",0
"Pucker",1,0,59536,Wiggs,"Wedge G7, Biggs G8, CLS G7, Ezra Leia",1
"Pucker",,,68194,Phasma,"Phasma FOTP G9, FOE KRU Kylo 4* G9",0
"Pucker",1,1,74781,JTR,"JTR G7, Scav Rey, BB-8 R2-D2 G8, Finn",0
"Pucker",,,76719,Nute-OR,"zNute zDooku Jango 6* G7, Zaalbar 6* Mission 6* G8",0
"Pucker",1,1,70812,Ewoks,"Chirpa 4* Elder Paploo 5* G8, Teebo Scout",0
"Pucker",0,1,86256,BH,"Bossk 6* G8, Dengar G9, Cad zThe Mandalorian, zBoba",0
"Pucker",1,1,62209,zEP,"EP Vader G8, Tarkin G9, TFP G5, BSF 5* G9",0
"Pucker",1,0,47142,501st,"Rex G7, Clone Sergeant G6, Echo (501st) G5, Fives G8, Ahsoka",0
"Pucker",0,1,68372,Phoenix,"Hera Zeb G9, Sabine 5* G7, Kanan Chopper",0
"Pucker",0,1,66902,BS,"BS 6* G7, GMY G9, Jolee 5* G8, Old Ben, JKA",0
"CurlyMech",1,0,75739,CLS,"zCLS G8, zHan G9, Chewbacca G9, R2-D2 G9, Old Ben",1
"CurlyMech",,,267275,HansMF,"Home One, Han's MF 5*, Biggs X-wing, Bistan's U-wing, Phantom Ghost Cassian's U-wing, Wedge X-wing",1
"CurlyMech",0,1,75898,Geonosians,"zGBA Sun Fac G7, Geo Soldier, Geo Spy G8, Poggle",1
"CurlyMech",0,1,95309,BH,"zzBossk Cad The Mandalorian, zBoba IG-88",1
"CurlyMech",1,1,111000,zEP,"zzEP zzzVader Tarkin Krennic TFP G8",1
"CurlyMech",0,1,75763,Phoenix,"Hera Zeb G8, zEzra Kanan G8, Chopper G8",1
"CurlyMech",,,44637,Phasma,"Phasma G8, FOE 5* G8, Sith Trooper 4* G7, KRU G8, Kylo G8",0
"CurlyMech",1,1,42857,NS_Alt,"MT 6* G8, AV G8, Talia 6* G9, Spirit 6* G8, Daka 6* G9",0
"CurlyMech",1,1,47866,Ewoks,"Chirpa 5* G8, Elder G8, Paploo G7, Wicket 4* G7, Logray G7",0
"CurlyMech",1,0,93672,zMaul,"Darth Maul, zSidious zDooku Sith Marauder, Nest 4* G7",0
"CurlyMech",1,0,52886,501st,"Rex G8, Clone Sergeant G8, Echo (501st) G8, Fives G8, Ahsoka G8",0
"CurlyMech",1,0,77216,Troopers,"Veers G9, Starck G7, Snowtrooper zzAdmiral Piett, Stormtrooper G8",0
"CurlyMech",1,1,49574,Rogue1,"Jyn G8, Chirrut G8, Baze 6* G8, K-2SO G8, Cassian G8",0
"Tyan Serg",0,1,146747,DRMalak,"zzzDR zzHK-47 zBSF zzMalak Sith Empire Trooper",1
"Tyan Serg",0,1,142919,padme,"zzPadme zGK zJKA zAhsoka zC-3PO",1
"Tyan Serg",0,1,97832,Geonosians,"zzGBA Sun Fac, Geo Soldier, Geo Spy, Poggle",1
"Tyan Serg",1,0,105234,CLS,"zzzCLS zHan zChewbacca zChewpio R2-D2 G8",1
"Tyan Serg",1,1,100394,Revan Offense,"zzzJKR GMY BS zJolee Ezra",1
"Tyan Serg",1,1,82665,Ewoks,"zChirpa Elder Paploo Wicket Logray",1
"Tyan Serg",0,1,119986,BH,"zzBossk zJango Dengar G9, zzGreef Karga, zBoba",1
"Tyan Serg",1,1,85488,Carth,"zCarth Onasi, Mission Zaalbar Juhani Canderous",1
"Tyan Serg",0,1,68562,Phoenix,"Hera Zeb G8, Sabine G8, Kanan G8, Chopper G9",1
"Tyan Serg",,,66187,Phasma,"Phasma G8, FOE G8, FOO G8, KRU G8, Kylo G9",0
"Tyan Serg",,,455559,Negotiator,"Negotiator HT Anakin's Eta-2 Starfighter, Umbaran Starfighter, Ahsoka Tano's Jedi Starfighter, BTL-B Y-wing Starfighter 4*, Clone Sergeant's ARC-170 5*, Plo Koon's Jedi Starfighter",0
"Tyan Serg",,,238947,HansMF,"Home One 6*, Han's MF 6*, Rebel Y-wing 4*, Bistan's U-wing 4*, Phantom Biggs X-wing, Cassian's U-wing, Wedge X-wing",0
"Tyan Serg",1,0,70582,Troopers,"Veers zzAdmiral Piett 6*, Moff Gideon, Dark Trooper 5* G8, Range Trooper 5* G7",0
"Tyan Serg",1,1,53422,NS,"MT 6* G8, AV G8, Daka G9, Zombie 6* G5, Spirit G8",0
"Tyan Serg",1,0,106688,ShaakClones,"zzShaak Ti, zRex zEcho (501st) G9, zzFives zARC Trooper G9",0
"Tyan Serg",1,1,94914,zEP,"EP zzzVader Tarkin DT G8, TFP G9",0
"Tyan Serg",1,0,55473,zMaul,"Darth Maul G8, Sidious G8, Dooku G8, Sith Marauder, Nest 6* G2",0
"Tyan Serg",1,1,46392,Rogue1,"Jyn G8, Chirrut 5* G8, Baze 6* G8, K-2SO G8, Cassian G8",0
"Reef",0,1,84788,Geonosians,"GBA Sun Fac, Geo Soldier, Geo Spy, Poggle",1
"Reef",0,1,72043,Phoenix,"Hera G9, Zeb Ezra Kanan Chopper",1
"Reef",1,1,66855,GK,"GK G8, Barriss Ahsoka G8, JKA GMY",0
"Reef",1,1,47527,zEP,"EP G8, Vader Tarkin G6, TFP G5, Traya 6* G8",0
"Reef",0,1,52262,FO,"KRU Kylo G8, FOST G7, FOSFTP G7, Phasma G7",0
"KyloRenJedi",0,1,152801,padme,"zzPadme zGK zJKA zAhsoka zzC-3PO",1
"KyloRenJedi",1,1,114884,NS_Alt,"zzMT Acolyte zDaka zzAV Zombie",1
"KyloRenJedi",0,1,115915,Grievous,"zzGG G9, zB2 zB1 zDroideka zMagnaGuard",1
"KyloRenJedi",1,1,131870,GAS,"zzzzGAS zRex zEcho (501st), zzFives zARC Trooper",1
"KyloRenJedi",1,1,122021,Ewoks,"zChirpa Elder zPaploo zWicket zLogray",1
"KyloRenJedi",0,1,104837,BH,"zzBossk zDengar G9, zzThe Mandalorian, zBoba zIG-88",1
"KyloRenJedi",0,1,86421,FO,"zzKRU zKylo FOO G8, FOSFTP FOE",1
"KyloRenJedi",0,1,87596,Phoenix,"zHera zZeb G8, zSabine G9, zEzra zKanan G8",1
"KyloRenJedi",1,0,96123,Wiggs,"Wedge G8, Biggs zzzCLS zHan G8, zLeia",1
"KyloRenJedi",0,1,62784,Geonosians,"GBA Sun Fac G7, Geo Soldier G8, Geo Spy G6, Poggle G6",0
"KyloRenJedi",1,1,72743,JTR,"JTR zzR2-D2 BB-8 G7, Resistance Hero Finn 3* G3, Resistance Hero Poe G7",0
"KyloRenJedi",1,0,90750,Traya,"Traya 6* G8, DN 6* G6, zSion G7, zzEP zzThrawn",0
"KyloRenJedi",,,52361,Nute-OR,"Nute G7, Dooku G7, Jango G7, Zaalbar 4* G7, Mission 4* G6",0
"KyloRenJedi",,,62724,Mon Mothma,"Mon Mothma 4* G6, Lando G9, zKyle Katarn G6, Jyn G7, zCara Dune 6* G8",0
"KyloRenJedi",1,0,70543,Troopers,"Veers G7, Starck G5, Magma G8, zzAdmiral Piett, Stormtrooper G8",0
"KyloRenJedi",1,0,58858,zMaul,"zDarth Maul G6, zSidious G9, Sith Empire Trooper G4, Sith Marauder 5* G6, Nest G6",0
"KyloRenJedi",0,1,94828,BS,"zBS G7, zzGMY G7, Jolee 5* G5, zzOld Ben, zzHYoda",0
"KyloRenJedi",1,0,58324,Jawas,"Nebit G6, Jawa Engineer G5, Jawa Scavenger G7, Jawa G5, Dathcha G8",0
